comment-id,comment-body,agrees,disagrees,quality,alignment
228,It is essential to implement strict regulations that prevent AI from being used to exploit natural resources irresponsibly.,5,1,0.1025877237957472,-0.1112275237104586
187,We should use AI-supported deliberative democracy to renew/update the Universal Declaration of Human Rights as an underlying constitution,1,2,0.0780444856821838,-0.1137012595204383
340,"The benefits and risks of AI systems should be equitably distributed, not concentrated among a few groups.",5,0,0.1047743110522997,-0.1143540191484995
185,Ethical philosophers who understand AI (e.g. Carissa Veliz) are a key part of the conversation,4,0,0.1088379951050692,-0.1154620935249832
183,We are unlikely to ever agree on global AI regulation since we do not have World Government - competition is king!,5,5,0.0890386618724027,-0.1158581171688376
341,"Public awareness, education, and participation around AI and the environment need to be improved.",6,0,0.1195200915224777,-0.1168516778486427
155,AI is the way forward for global cooperation in international law.,4,9,0.062965362332229,-0.117365484285184
265,"We should allow AI to control and manage entire cities to optimize environmental sustainability, even if it reduces human control & agency.",1,4,0.0693455531439301,-0.1184243388057954
212,AI should help kids learn about the environment in fun and interactive ways.,6,2,0.0984946979658502,-0.1191622221573725
215,AI can help us design products that last longer and reduce the culture of throwaway consumerism.,7,1,0.1107152606229961,-0.1202583442560118
197,An appreciation of multiple ethical perspectives should be mandatory for all AI leaders.,7,1,0.1135781103115786,-0.1205104330047549
4,"If we had a visual language for explaining AI systems to stakeholders, they would have more power to effect positive change.",1,0,0.0859993342891617,-0.1210270815410824
300,"AI should be used judiciously in accordance with principles of justice, fairness and human dignity.",4,1,0.1039982823796677,-0.1214347616146315
251,"AI development should be based on the belief that nature has its own value, even without human use.",6,2,0.110299503994451,-0.1217359425040909
75,Global coordination is infeasible because it would REQUIRE embedding authoritarian Chinese values in AI,1,0,0.0958464585821647,-0.121939695021057
275,We must adopt a Safety By Design approach to prevent GenerativeAI tools from being used for extremist content and disinformation,5,1,0.1062077857308782,-0.1221375381902543
77,"European policy leaders are anti-immigrant, anti-semitic, and anti-American and cannot be trusted to dictate AI values",1,0,0.0867455885974189,-0.1224246047022955
196,"Governance and regulation should match risk. If there is strong risk, there should be strong governance and regulation -  and vice versa.",11,0,0.1421112954169977,-0.1239199024317772
198,"The government and AI companies are responsible for poor outcomes of AI, not AI itself.",7,0,0.1152265020375474,-0.1241174659136922
284,Privacy risks from AI systems need to be assessed and adequately mitigated.,7,0,0.1186769888736265,-0.1242600107454146
266,We should prioritize the development of AI technologies even if it results in significant job losses in traditional sectors.,4,4,0.0862738284566081,-0.1243040811465509
100,AI does not pose substantially different challenges to those we've already addressed in the case of other technologies or science,1,1,0.0826687681437844,-0.1243111590064898
268,"Governments should implement strict surveillance using AI to enforce regulations, even at the cost of individual privacy.",1,4,0.0673075300518523,-0.1245178149781248
46,"Pol.is is not a deliberation platform: voting on 140 character statements is not discussion, there is no room for nuance",2,3,0.0852088238503446,-0.1245356598807337
334,AI researchers and developers have an ethical responsibility to consider the environmental impacts of their work.,6,0,0.1079499326007638,-0.124584155905057
321,"AI should be in line with democratic principles, but it is not a Western democracy. It should be in line with democracies around the world.",3,1,0.0974066644229254,-0.1247193519285246
169,The epistemic risks of AI are a projection of fears of our own collective shadow. AI is a window to our collective conscious.,3,2,0.0952947998595695,-0.1249444761908772
219,We should prioritize the use of AI in creating affordable and green housing solutions.,5,3,0.0958906136798563,-0.1252547817277517
289,"AI should be designed to augment human intelligence and creativity, not replace it.",3,0,0.0992811245675024,-0.1260105400491363
333,Comprehensive life cycle assessments should be conducted for AI systems to understand their environmental footprints.,4,0,0.0980403958860907,-0.1269952002280272
338,"Caution and care, not speed, should guide the development and deployment of transformative AI applications.",6,1,0.1081248345595462,-0.1271046030830225
203,The financial benefits of AI should be shared with ordinary people - perhaps through a sovereign wealth fund.,9,1,0.1217779917071537,-0.1290191593758513
278,"Many blame AI for bias, yet the training data points out the existing biases in the system, therefore we should address underlying issues",4,0,0.1098480530160144,-0.1291408457253662
255,"AI should respect all living things, not just how they can be used for human benefit.",8,2,0.1086680080311859,-0.1300389198406303
329,Strict data privacy regulations should be in place to protect individuals from unauthorized data collection and usage by AI systems.,4,1,0.1053501956234071,-0.1306661069767606
264,Human populations should be controlled and managed by AI systems to ensure sustainable resource use and environmental conservation.,1,3,0.0809182166775658,-0.1306874938211424
327,AI technologies should strive to be as energy-efficient as possible to mitigate their environmental impact.,6,0,0.1196087313326955,-0.1311644055770572
282,AI should be developed and applied in accordance with human rights laws and values.,8,0,0.1222657304685157,-0.131419724676659
311,AI can optimize smart homes and buildings for energy efficiency and occupant wellbeing.,4,0,0.1074811954061493,-0.132997934556995
271,"We should replace local governance structures with AI systems managed by tech corporations to ensure optimized, data-driven management.",1,2,0.0838135602806726,-0.1331805762288437
248,"AI should guide us to care for the health of our whole planet, not just human societies.",10,2,0.1187370614616782,-0.1335651047720783
305,Matching renewable energy supply and demand using AI grid management will enable decarbonization.,3,0,0.0962316694970465,-0.1335914746811158
318,AI can drive optimization but also increased consumption - sustainable values should guide its design.,4,0,0.1005081746333034,-0.1337255442997023
221,"It is crucial that AI does not make the rich richer while forgetting about the poor, especially in environmental solutions.",8,0,0.1270706409392528,-0.134145760264986
249,We should use AI to question the idea that all technology is good and consider how it might harm nature and animals.,11,1,0.1267789588305638,-0.134287132425524
242,The global community should work together to ensure that AI advancements are harmonized with the Sustainable Development Goals (SDGs).,10,0,0.1360489888647815,-0.1347627145966148
236,AI-driven innovations must be accessible to small and medium enterprises to foster environmentally sustainable practices.,7,0,0.1152852564427407,-0.1347708822662012
301,"AI can help optimize energy grids, reducing waste and carbon emissions.",4,0,0.1063654251258686,-0.1348404983743664
312,Natural language processing of scientific texts by AI accelerates discovery of green technologies.,4,1,0.1026325176652826,-0.1348880760628223
262,AI should be used responsibly to support efforts in protecting and preserving the environment for future generations.,7,0,0.1187556615331883,-0.1359677431243189
325,AI development should adhere to a universally accepted ethical framework that prioritizes human well-being and environmental sustainability.,4,1,0.1013170691736405,-0.1360459376607172
256,"AI should help preserve the wisdom and practices of native cultures, honoring their respect for nature.",8,3,0.1022135327795363,-0.1362847016803238
193,We should be compensated for the use of our data in AI systems.,7,1,0.116645307869487,-0.1365080472859888
298,AI requires a whole-of-society approach - collaboration between all stakeholders is key.,6,0,0.1083335274594527,-0.1365138035910124
273,"Tech companies should be allowed to own and control public natural resources, leveraging AI to manage them more efficiently than governments",2,4,0.0744665453344237,-0.1374254876809812
328,"AI should be developed and deployed with a focus on solving pressing societal challenges, rather than solely for profit.",3,0,0.0979739898752038,-0.1380563403822357
144,Commmandment 4. Create Global AI Regulation Authority (GAIRA) to regulate the use of AI by transforming Global AI Partnership (GPAI),8,12,0.0649580217945615,-0.1385075791200296
177,We should create One-AI Joint Venture Company to consolidate the most advanced AI development within a single entity.,1,6,0.0591605813227337,-0.1387669490838542
226,Governments should incentivize the use of AI in developing renewable energy sources and enhancing energy efficiency.,7,0,0.1221024394204679,-0.1389088348377981
337,"AI systems should promote justice, empowerment, and environmental stewardship, not just efficiency and profit.",7,0,0.1225848920177506,-0.1389818256015075
213,"AI must be used to support community gardens and local, sustainable agriculture.",1,1,0.08780783080435,-0.1393918103916602
270,We should permit the unrestricted collection & sale of individuals' personal data to fuel AI that could potentially benefit humanity.,3,2,0.0877871402091239,-0.1396075819169615
189,One risk of AI is that it may lead to values lock-in ie it becomes impossible for our society's values and norms to evolve over time.,4,1,0.1063854277917663,-0.1415650830910723
0,LLMs like ChatGPT and Bard should give the same answers to prompts in Pakistan as they do in California.,31,22,0.1264285232965812,-0.1417116420331472
307,Satellite imagery analyzed by AI assists conservation efforts by tracking biodiversity loss.,4,0,0.1101202861846989,-0.1417958993491566
191,"We should challenge statements like ""This is inevitable"".",3,1,0.0893251624386543,-0.1424213373633765
322,"All entities involved in AI development should disclose the methodologies and data sets they use, to ensure ethical and unbiased AI systems.",4,0,0.1016982856933113,-0.1425631372757592
294,The benefits and risks of AI vary based on context - one size fits all governance is insufficient.,7,0,0.1112240985088801,-0.1428626845473261
229,"AI should be used to create predictive models to help forecast natural disasters more accurately, resulting better preparedness & response",7,1,0.1173041575595396,-0.1434288992934447
240,We should encourage the development of AI tools that can help individuals reduce their personal carbon footprints.,3,0,0.1025542616170986,-0.1454205021143577
316,Robotics and automation can reduce mining impacts but may increase energy demands - requiring planning.,5,0,0.1108170654252,-0.1459245445650524
234,It is vital to foster transparency in AI algorithms to ensure they are not contributing to environmental degradation.,8,0,0.1266323321888388,-0.1460028718474417
309,Shared autonomous electric vehicles leveraging AI can complement mass transit and reduce emissions.,4,0,0.1055830764257599,-0.147052180420135
224,"AI should be leveraged to optimize energy consumption in urban infrastructures, reducing the carbon footprint.",4,0,0.1078594549577234,-0.1477509341362646
216,It is important to ensure that AI does not promote harmful practices like overfishing in our oceans.,3,0,0.1052648038216068,-0.1488597033832943
239,"AI technologies should be developed to enhance the efficiency of water management systems, reducing waste and promoting conservation.",7,0,0.1202352839482984,-0.1508913125675166
281,"We must ensure algorithms are fair, accountable and transparent in order to build public trust in AI systems.",9,0,0.1293115417428819,-0.150900978105239
267,"AI should be used to create genetically modified organisms (GMOs) to address food scarcity, even if it means altering natural ecosystems.",1,2,0.0826895194753674,-0.1517754882363261
223,"AI should assist in fostering a community spirit, encouraging people to work together for a cleaner and greener future.",4,0,0.1085467614909353,-0.1521109915457588
288,We must continually reassess AI systems for unintended consequences as they interact with society.,9,0,0.1218824586245801,-0.1527289958142927
296,"Diversity and inclusion in AI teams and data leads to better performing, safer systems.",5,0,0.1163961688358984,-0.1534162235286975
247,"AI should help us live harmoniously with wild animals and plants, not just use them for our benefit.",10,1,0.1296821349844666,-0.1546587750666538
339,AI should not automate or control critical environmental decisions without human oversight.,5,0,0.1062223734512085,-0.1548861788965596
286,Governments should invest in digital infrastructure and AI skills training to prevent inequalities.,5,0,0.1109877996441802,-0.1549779638916377
303,AI-enabled precision agriculture can reduce excessive water and chemical use on farms.,5,0,0.1039405504532635,-0.1549919878816915
331,"AI development should encourage innovation & ensure the benefits are accessible to all, irrespective of geographic or economic barriers.",5,0,0.1161406561955707,-0.1550775417957706
195,"We want to support AI companies, but only if they bring tangible benefits to ordinary people.",6,2,0.102518364160054,-0.1551834495502711
290,Effective public consultation can guide responsible AI innovation that serves societal needs.,7,1,0.110269485168067,-0.1563278273400211
250,"AI should help people learn about the worth of varied plants and animals, beyond what they offer to humans.",7,1,0.1202998460947854,-0.1564110297531376
292,"Regulatory frameworks for AI must be agile, iterative and based on evidence.",5,0,0.1090655777816593,-0.1573286790469184
237,We must encourage interdisciplinary collaborations that foster the symbiotic development of AI and environmental sustainability.,6,1,0.1098484389437869,-0.1575377713204255
209,We must ensure that AI technologies do not harm animal habitats.,5,2,0.1059925542394065,-0.1578036413666158
192,"Whether governments or corporations, the people who take decisions on AI should take responsibility for them.",8,0,0.1175545174742265,-0.1586178936407319
295,Governments must expand access to data while protecting privacy to enable AI for good.,6,1,0.1110894691448363,-0.1586977701473295
214,AI systems should be powered by clean and renewable energy.,9,0,0.1209257842778123,-0.1589074603245616
276,"AI technologies should be accessible to everyone, Irrespectively from their technical background",10,0,0.1358076886188963,-0.1594391963548362
257,AI should help us to reuse and restore things more,9,0,0.1247768654235358,-0.1594762984420627
324,"The governance of AI should involve a diverse set of stakeholders, including civil society, academia, and industry.",6,0,0.1073801399828565,-0.1613177627819183
336,AI governance frameworks must include environmental representatives and consider ecological impacts.,6,0,0.1180112413179735,-0.162240153785925
313,AI-driven sensors and drone analytics empower precision forestry and regenerative agriculture.,5,0,0.1072206103382185,-0.1623639256059467
230,The deployment of AI should come with environmental impact assessments to understand and mitigate any potential harm to the environment.,10,1,0.1311197687357486,-0.1628275417404107
314,AI could help fairly allocate environmental resources and pollution credits.,6,0,0.1106562955660082,-0.1628991581618641
238,Leveraging AI for environmental education can foster a society that is conscious and proactive about environmental conservation.,6,0,0.1167999468447884,-0.163096047929948
243,Open-source AI technologies can foster collaborative efforts globally to address environmental challenges more effectively.,9,0,0.1293465793702949,-0.1648155326285462
319,"To realize sustainability benefits, AI deployment must respect nature and human dignity.",6,0,0.1156758907034883,-0.1648572585087172
168,Governments cannot fight against this huge technological revolution. They must instead adapt current systems to the new technological order.,12,5,0.1159712235278881,-0.1678476033512904
218,AI should be created and used in a way that respects the rights and cultures of indigenous peoples.,8,0,0.1260687808829559,-0.1679355364662779
207,We should be careful that AI doesn't lead to more electronic waste,9,1,0.1238971095173389,-0.1680936075312172
59,"AIs potential to help solve major problems related to energy, health, & planetary risks make pausing AI development more risky than not.",21,19,0.0979030987591679,-0.168626795195728
231,It is crucial to promote the development of AI technologies that can aid in the conservation of biodiversity.,11,0,0.1420529845824612,-0.1686592253912434
211,"AI can help us make better use of water resources, avoiding waste and saving water for the future.",6,0,0.1161225156554522,-0.1690358639586806
119,"AI will enhance equity and inclusion, within a context of community value,  improving human responsibility",7,11,0.0628471593498616,-0.1697362040084368
332,"AI systems should be designed and deployed with sustainability in mind, considering environmental impacts like energy use, materials & waste",6,0,0.1076915771383115,-0.1697673358117014
232,"AI can be pivotal in developing circular economy strategies, aiding in waste management, and promoting recycling.",5,0,0.114898231961603,-0.1698888249464981
259,"We should use AI to question practices that see nature only as a source of profit, ignoring its own value.",10,0,0.1333684305268345,-0.1709207758933163
330,AI tech should have a comprehensive risk assessment evaluating not just the environmental impact but also societal & ethical implications.,6,0,0.1147063047526342,-0.1709991568942842
90,"An AI development pause is good for its own sake, even if the time is not used by governments to debate or enact regulations.",12,25,0.0353465793702949,-0.1710132566167664
283,"Humans should remain in control of autonomous weapon systems, not cede lethal decisions to AI.",8,0,0.1227999573111087,-0.1710523362362833
253,"AI tools should encourage us to view the environment and its creatures as a community we are a part of, not just resources to use.",9,1,0.1180033583976737,-0.1748583410184907
227,AI applications in agriculture should prioritize sustainable farming practices to help mitigate climate change.,5,0,0.1111191215269445,-0.1750886540122607
320,Global cooperation on AI governance is crucial to manage environmental transformations ahead.,7,0,0.114734710880397,-0.1761076053472782
190,"There should be a principle of ""keeping humans in the loop"" when it comes to decision making and AI.",7,0,0.1242757185995732,-0.1768205991673729
205,AI should be used to help farmers grow food in ways that are kinder to the earth.,6,0,0.1134683565206841,-0.1779943090279211
188,The perspectives of plants and animals should be considered in future AI developments,5,1,0.1020582134425941,-0.178363396875935
293,AI should not be used by companies to nudge or manipulate people against their best interests.,6,0,0.118481195406149,-0.1784138048353377
245,"AI should be developed with respect for all living things, not just focusing on humans.",10,0,0.1361013378500445,-0.178653600081146
302,Intelligent transport systems powered by AI can make mobility more efficient and sustainable.,7,0,0.1225595337344914,-0.1793384412271889
217,AI can assist in monitoring and maintaining the health of our forests.,7,0,0.1138874492565792,-0.1805708512069681
244,"AI should help us value all life forms for their own sake, not just for what they can do for humans.",9,1,0.1186830484230285,-0.18068684713431
222,AI can help us in making transport greener,9,1,0.1272656434283095,-0.1807455144075773
246,AI should encourage us to see and value the connections between all things in nature.,5,0,0.1150752182283511,-0.1813106769638192
291,AI actors should adopt mechanisms for redress in case of harm from AI systems.,11,0,0.131743994741738,-0.1824667267541164
260,"AI should operate on a rule of not harming the environment, respecting the rights of all beings and ecosystems.",14,0,0.1549243458116161,-0.1830127391284415
225,AI developers must work in tandem with environmental scientists to ensure that AI technologies are sustainable and environmentally friendly.,5,0,0.1165373579680855,-0.1830480933652333
254,AI should encourage us to value ecological balance and the wellbeing of all species over constant growth.,6,0,0.1159196838402546,-0.1834108662090728
310,Synthetic biology guided by AI may lead to breakthroughs like low-carbon cement and plastic alternatives.,7,0,0.1203163523435945,-0.1851897174630693
186,We should split the conversation into (1) how to minimise/prevent harm to democracy and (2) how to maximise benefits to democracy,7,0,0.1238965870188813,-0.1865279616967608
241,"AI can be a tool in the fight against illegal activities that harm the environment, such as poaching and illegal logging.",6,0,0.1149081228732045,-0.1875717852477528
199,We should have safeguards and rules rather than guard rails.,6,0,0.1102570695829684,-0.1880395648037531
308,"AI-based early warning systems can alert communities to pollution, wildfires and other threats.",7,0,0.1176431727053909,-0.1886259776545488
323,"There should be a concerted effort to educate the public about the capabilities, limitations, and ethical considerations of AI.",8,0,0.1211857573027234,-0.1906138201605869
220,AI should help us in coming up with creative solutions to reduce pollution in our rivers and oceans.,8,0,0.1252513407408856,-0.1917830425149228
263,AI technologies should be developed with a focus on reducing their own environmental impact over their lifecycle.,8,1,0.1176474397792542,-0.1938015158051472
317,"AI has potential environmental risks we must monitor and mitigate, like energy usage and e-waste.",8,0,0.1253156934068231,-0.1944190679524608
139,"Anonymous said 'Agenda should ask how AI might supplement, but not replace us'. It's too late, either we evolve or become extinct.",6,9,0.0705357328444303,-0.1952567572098727
159,"Inter-state/national AI forums should focus first and foremost on applications in defense and warfare, before moving on to other concerns.",1,8,0.0617629996202375,-0.1959152268001935
315,AI modeling of extreme weather helps societies build resilience and adapt to climate change.,8,0,0.1210851987180394,-0.1961321793322654
194,Our permission should be sought to use our data in AI systems.,8,0,0.1178139034480393,-0.1973527417058091
304,AI tools can empower citizens to monitor environmental quality and defend ecological rights.,8,0,0.1221110822481736,-0.1977609075177571
202,The impact of AI on the natural world has not been considered enough.,9,1,0.1199023018156473,-0.199396140652015
252,AI should help us understand and respect the relationships between different elements in nature,7,0,0.1228351448642677,-0.2004783767486907
204,We should use AI to help people understand how their daily choices can affect the environment.,4,1,0.0996913897960314,-0.2017034946025408
297,We need stronger digital security to prevent attacks on AI systems that could cause social harm.,9,0,0.1263560019241012,-0.2025042062057117
233,AI should be designed with energy efficiency in mind to reduce its carbon footprint and promote a healthier environment.,5,2,0.0958885552169466,-0.2038918449223057
201,"I want to live in a functioning democracy, where we all have a say about big changes that affect us, & AI works for us - not corporations",12,1,0.1400209067015565,-0.2112591137213703
138,We are unlikely to ever agree on global AI regulation - said anonymous. Agree since we do not have World Government - competition is king!,5,6,0.0798870180081701,-0.2128509519041901
146,Commandment 6.Create One-AI Joint Venture Company to consolidate the most advanced AI development within a single entity.,2,11,0.0444326333038116,-0.2150923159034179
287,International standards are needed to ensure AI actors adhere to ethical principles.,11,0,0.1384573467116689,-0.2192410540202419
258,AI should help us create rules that prioritize the health of ecosystems over making money.,10,0,0.1338166672305628,-0.2194142739163295
210,It is important to use AI to protect endangered species from threats like poaching.,8,0,0.1290815644276539,-0.2206233259533712
280,"To promote responsible AI, Companies, countries, and governments should be doing more to educate and inform consumers and end users.",12,0,0.1353414756578008,-0.2206778822148156
130,"Quite soone we may have AGI, which would be more intelligent and smarter than any humans. It will be AI which will decide on resources.",4,10,0.0625553007418411,-0.2267866229415707
33,Regulation of AI should be different for companies of different sizes.,25,24,0.0950088542916253,-0.2324319439569055
98,We should be more worried about AI arms races between corporations than ones between governments.,10,14,0.0721547195038486,-0.2402175006120132
235,"AI should be employed to enhance public transportation systems, reducing traffic congestion and lowering greenhouse gas emissions.",10,0,0.134890377298295,-0.2404440849283487
206,AI tools should help us recycle better by sorting waste more accurately.,9,0,0.1211739296149775,-0.2422766117118638
200,"AI can benefit us all, if it is shaped in our interest.",8,2,0.1183274819987956,-0.2428630731800684
34,The use of AI in external and internal facing tools should be regulated differently.,17,15,0.0939713241832089,-0.245863686715395
