comment-id,comment-body,agrees,disagrees,quality,alignment
20,"Institutions, business and governments need to be transparent in the ways they use AI, we need legislation and regulation to secure this",75,6,0.2853463543947772,0.9212378650020286
11,"Global AI regulation needs to involve civil society, academia, industry and the open source community to get to the best possible outcome",83,4,0.33380391503567,0.878502008755911
65,"Governments should consider public investment in, and development of, AI to steer applications towards generating long-term public benefit.",52,2,0.20432295891494143,0.8404061383255437
21,Decisions about how this tech is developed should not lie solely in the hands of private companies and their employees,76,1,0.31900510599764276,0.8263824762181244
23,"Governance of AI must pay attention to its material dimensions e.g. its energy demands, or the creation of physical infrastructure",68,5,0.26400750505115755,0.8072388400119894
68,"We should consider how to incentivize AI for common good (better democracy, less pollution, improved education) rather than cost-efficiency",47,1,0.1901693986057277,0.8030171493157654
44,AI could aid in discovering production/extraction efficiencies (of scarce resources) and also accelerate human-caused environmental damage,47,5,0.17063730175761907,0.7968418472010201
79,"AI's advantages and weaknesses (Better memory, faster thinking,Heavy energy dependence) Should be communicated more clearly to the public.",43,0,0.18093526424242,0.7847604989898253
12,The ability for frontier AI models to undermine democracy is an underaddressed problem.,70,15,0.2289474620649776,0.7752455324694435
14,We need a permanent global deliberative forum for the regulation of AI development.,64,9,0.235524835283854,0.7711261960142916
8,Bias in training data is an area that needs to be urgently addresses to prevent the perpetuation of discrimination and cultural stereotypes,78,11,0.28580757832635284,0.770776354003649
28,"Greater priority should be awarded to educating the public on AI's societal impacts, including its incorporation into national curriculums",50,2,0.2041475494454399,0.7677756138136771
10,We need global standards in place to evaluate the environmental impact of AI technologies,80,12,0.2859699893682968,0.7657549050119508
9,"We need to foster better education and awareness of generative AI, it’s potential benefits and it’s limitations/biases.",77,3,0.3158811985574964,0.7653057171314915
67,"A business imperative (i.e., profits, growth) must not be the driving force of AI innovation",47,10,0.15556787682920883,0.755539958370022
19,We should be very weary of AI models being trained on data previously generated by other AI models,63,4,0.24775788265465276,0.754689808650585
42,Steps must be taken to ensure that future technological developments do not concentrate power in the hands of the state or private companies,52,5,0.1982275843419629,0.7489400850981858
17,AI should be embraced for the public good. Private entities controlling either need to be open source or governed by a public body,60,19,0.1733810003360219,0.7156237208411425
48,"AI governance alone is not enough: it is necessary to critique both the state and capitalism, to understand how AI consolidates their power",48,9,0.16297091630320326,0.7129809181553194
94,Communities affected by use of AI tools must have a say in decisions about their development or adoption,43,5,0.1599587561845744,0.6979404866938953
92,AI regulatory bodies should be created to rapidly respond to novel less-than-existential AI alignment failures while legislation catches up.,37,4,0.13717287304533254,0.69540470559023
64,"Governments should clarify liability law, so that legal & financial liability for AI risk is distributed fairly along AI value chains.",42,1,0.17003298761420235,0.6886538104047997
66,"Governments should introduce mandatory reporting requirements for foundation model developers, e.g. at the start or end of training runs.",45,6,0.1647858941731598,0.6690726825119812
82,"The material costs of computing and AI (electricity, water, land, ...), and who gets to decide to spend those, are a key governance issue",45,8,0.15576104071866703,0.6629307357622433
43,"AI may perpetuate not only cultural bias, but an ontology that is capitalist/extractive/zero-sum—embedding unsustainable mindsets is a risk",52,9,0.18355318712590843,0.6438970889808032
7,"Global AI regulation needs to empower the open source community as without it, it will be very difficult to have the right checks in place",55,13,0.1824482236679316,0.6303623151615099
36,"Future AI models have the potential to lower expertise barriers for crafting biological weapons, which poses a significant global threat",43,6,0.16141872237187255,0.6278650491798685
80,There needs to be a great shift towards funding/investing in AI interpretability research instead of raw capabilities as soon as possible.,34,1,0.1406681133678039,0.6120998090720533
32,"We need more pragmatic and less moralistic discussion on how to democratize AI (e.g., public funding (access) and IP reforms(innovation))",42,4,0.16681238024373204,0.6099257922339577
27,Companies and institutions should be formally celebrated when they explicitly label interactions with them as AI or human-based,56,13,0.18846628322514525,0.6092121857347407
69,"Should think about how AI may enable global coordination solutions, enabling major states/institutions to cooperate against other crises",40,2,0.1675982039914617,0.5952492830310292
2,Sovereign AI capacity is essential: it cannot just be private companies developing AI.,57,12,0.1987514469006528,0.5947326717590073
22,Democratisation of the development and deployment of AI is inherently limited if we do not also democratise the ownership of its production.,60,15,0.19699114495537057,0.5801145021943438
6,My work shows that the data used to train AI is the most important thing to focus on. We should regulate its use carefully.,37,10,0.11304394411802234,0.5656290775899823
71,An arms race for AI supremacy cannot be allowed,32,4,0.1222088001189566,0.5572049187655824
70,"We must solve for a sustainable, adaptive, & effective global coordination mechanism",39,6,0.14765830175570083,0.5505046667910368
102,"Short-term AI risks to economic and social inequalities are linked, and should be addressed together in ways that acknowledge intersections",33,2,0.13571849905364153,0.5446081831141665
5,"We need multiple approaches to governing AI, Focus on one too much means privileging some aspects of society over others.",49,8,0.18301211342451157,0.534821613390421
13,We must be careful not to conflate dangerous 'language hacking' potential of LLMs etc with the tremendous benefits of focussed AI tools.,42,6,0.16124213705354695,0.5299656983111598
95,We should think about many schools of moral philosophy when developing AI,31,1,0.12909281693274405,0.5126172863915747
89,"AI alignment failures are better to happen sooner, with less powerful systems, than later, with more powerful systems.",31,2,0.1274378752871832,0.4825137695131767
58,"AIs should consider the effect their decisions will have on human freedom & autonomy balanced against on peace, harmony, and safety.",36,10,0.11940712437668664,0.4569371068390766
72,Overreliance on AI may exacerbate a less skilled & less engaged citizenry,33,13,0.08948449128220418,0.45447139121542246
96,The way the media report on AI is driving a hype that is counter-productive to the broad objective of developing ethical frameworks.,31,6,0.11530003658280363,0.4420283860766903
35,I think the development of AI will relate heavily to the cultural shifts present in our phase in history w/ institutional trust.,31,3,0.12718018787538599,0.43950550627692714
62,"Asking AI to seek truth may provide some safety, but we should also align AI with other values like having fun, freedom, and love.",35,13,0.09734106000951226,0.43897182591317097
84,Among the goals of an aligned AI superintelligence should be the material prosperity of all humans relatively equally.,30,7,0.102987745597768,0.4209553488786799
29,"Greater focus should be placed on tackling the near-term risks of AI (bias, misinformation, etc.) than the existential risks.",54,30,0.110051333453854,0.41263720287284
49,The epistemic risks of AI are a consequence of how our social structures enable and incentivise wealth accumulation,39,19,0.09197595810985043,0.41042114439386573
97,"More attention should be paid to short-term AI risks related to economic inequality, relative to social inequality, than there is currently.",31,6,0.11494933601475324,0.3757301813950333
81,"On their current development and release paradigm, LLMs are far more likely to pollute and degrade our information ecosystem than improve it",34,12,0.10238121770936842,0.37239819140603825
26,"Societies need to be preemptive and design for mass unemployment linked to AI, rather than wait and react after people start suffering",53,16,0.1667530700281274,0.36355963081114934
18,The use of AI needs to be embraced within education systems to shift away from memorisation model to a critical and creative one,50,12,0.17824183698322751,0.34961851182717085
73,"An agenda should ask how AI might supplement, but not replace us",30,5,0.11737412193178212,0.34949786350529527
108,AI development should be targeted at clearly demarcated contexts and the communities in those contexts involved in the development of the AI,18,5,0.06324129915101123,0.34941507811643774
93,"More safety checks, peer review, and scrutiny from regulatory bodies, needs to happen before a Large singular AI training run even begins.",27,7,0.0911785753165939,0.34536163483710824
83,The creation of sentient AI should be avoided if non-sentient AI of identical capabilities are possible instead.,23,8,0.07149178116016675,0.33831758491431724
85,AI development should not be accelerated on the fear that China might get ahead of the US.,29,13,0.07569331891187876,0.3329095985912194
1,We need a single *international* approach to AI governance - national is not enough.,54,22,0.1494363819027608,0.32866118750521306
117,AI has the potential to create a more equitable world if approached critically & ethically. I'd like to see the ethics of AI advanced.,28,5,0.1133137265180172,0.3099144767619357
120,We need quality regulation that stops abuses and dangerous developments but is fast and does not prevent new ideas and innovation.,30,5,0.1182891445099419,0.3017454796188367
57,"Love in the forms of connection, tolerance, caring, and compassion are central human values that should be encouraged in AI training.",22,12,0.054330906433792805,0.29517696489916484
16,AI's potential and pitfalls are overstated by AI 'experts'. The conversation about it shouldn't exclude opinions of everyone else,42,12,0.1441988705645121,0.2941928136833147
114,"The US should establish a NIST or FDA-style federal agency to regulate the development and deployment of AI, particularly frontier models.",19,2,0.08366862857069807,0.29387642582675694
86,A world of many AI superintelligences is preferable to a world with only one AI superintelligence.,19,5,0.07351427952632375,0.293565113577526
41,"In their current level of sophistication, LLMs like ChatGPT do not appear convincingly worrisome—it's what they imply will come next",34,16,0.08461714087481446,0.2778627927619577
111,"To mitigate AI existential risks we must also research how, and prevent that, AI's can influence and manipulate humans to do their bidding.",32,7,0.1213622424602492,0.26383874341855984
15,AI will create capacity in the labour market as it takes on easier repetitive tasks. This will should work with not against working reform,31,10,0.10042268269765268,0.2477569615457176
118,We need policy provisions for the design and methods by which AI is developed to ensure it is safe and not harmful or breaking human rights,31,2,0.13575398812843242,0.23825003498855124
99,"The pace of AI development should be dictated by the public, not companies",26,15,0.06301808037244361,0.216721704360726
61,Everyone should list their preference for maintaining their individuality as we become increasingly connected to AI and each other.,21,8,0.07104826575840717,0.2147829173406204
125,Data assets must be made more widely accessible to ensure AI can be widely developed (democratised); rather than power concentration by few.,20,2,0.0930227164409052,0.2115385061249301
38,We should encourage nation-states to regulate AIs as if they were as risky as nuclear technology,36,32,0.028425142600192247,0.21104356916017764
116,We need policy provisions for the design and methods by which AI is developed to ensure it is safe and to prevent market fragmentation,17,1,0.07986039693111206,0.2003202853803128
135,All AI programmes must be coded to self-identity as AI and be accompanied by detection software.,11,2,0.05593774437532735,0.18420471159201676
110,There is no such thing as safe open source ai. Any safety measures or bias mitigation can be reverse engineered.,15,6,0.05168386787819591,0.18128572791706568
126,The only way to police the development and use of AI is by using AI itself.,10,18,-0.020141815641141547,0.18007549049138927
55,"The development of AI companions is net beneficial to humanity, and should correspondingly not be banned.",29,11,0.094364586496643,0.1793127492208908
156,"My biggest worry is what entities can be trusted with controlling such powerful technology, especially given the interests of Zuck, Musk etc",18,2,0.08715319157833824,0.16480730632680057
87,"Successfully aligned AI will use many schools of moral philosophy, not just one.",10,0,0.05838113113034264,0.16309297080081883
60,Predicting as far into the future as possible is critical for existential safety as it allows earlier detection and mitigation of threats.,35,21,0.07539047291231712,0.15426640956793225
127,"With the unlimited potential for AI, there has to be a back up business continuity plan to cater for circumstances when AI could go wrong.",22,1,0.10979200516627946,0.15093931490213236
3,I am nervous and pessimistic about the current direction of AI development.,27,39,-0.03849607846399532,0.14397489991197973
47,"The issues we are discussing with AI are present in already established areas inc. statistics, quantitative research, and machine learning",15,6,0.05303544876398075,0.13631671577779064
158,AI regulation will be contingent on better regulation of mass data collection.,13,3,0.0630149732279506,0.1263007059794311
103,Western arguments that we are in an AI race against China and therefore must innovate quickly are ill-considered,19,12,0.0452634380560446,0.1069319233222974
160,More attention should be given to risks in psychological exploitation of consumers and civilians by AI developers and users.,20,0,0.10618290893931386,0.09975800105848669
105,"I think that, on the whole, the West is more advanced and is accelerating faster in AI development, compared to China",15,8,0.051449741651148954,0.08882953287648479
164,"Like most technologies that are powerful but dangerous if used incorrectly, users should share responsibility with designers for AI safety.",8,2,0.044760104857914915,0.08554540958701742
52,"At some point we must consider consciousness/sentience and when AI might be ""awake"", potentially deserving ethical rights & considerations",28,24,0.031049161526571088,0.08534987608700034
157,We have reached a point where technology is evolving much faster than humanity and human societies can handle,9,7,0.02877937054169636,0.08122545252923503
113,We should talk about how OpenAI is interfering with non-profit efforts and prevent it somehow,8,4,0.032524726388383406,0.07511042229148927
143,Commandment 3.	Retain control over AI governance beyond 2030,10,4,0.04383494889110221,0.06541725402604592
154,"Local CSOs need long term, predictable funding for capacity and consultation to ensure global majority views are meaningfully represented",4,2,0.028793522530798327,0.06250491228211974
167,AI companions should not be used as a replacement strategy for real human contact in our fight against loneliness and isolation.,15,3,0.07011132339383574,0.05689724275256901
31,We should discourage any use of AI to generate statements that look like facts.,19,21,0.008332088391935267,0.052682303050123336
50,"We must solve for a sustainable, adaptive, & effective global coordination mechanism—an arms race for AI supremacy cannot be allowed",5,1,0.03664935802830245,0.045709314258751105
152,Setup permanent on-going support for AI Safety Summits as virtual monthly global conferences supported by a debating platform eg Telepresent,13,2,0.06569866494106014,0.04250415782298009
163,Artificial general intelligence (AGI) should make easier life easier but we should aim to have a human-in-the-loop controlling AI.,8,1,0.05062587968029983,0.040072190075424965
53,"A business imperative (i.e., profits, growth) must not be the driving force of AI innovation—look where that got us with social media",6,1,0.042891281738518174,0.03760442129454572
131,Pace of AI development should be dictated by the public but realistically it will be AI companies because of exponential pace of change.,12,4,0.05772174280312649,0.035226054478795996
161,"Use of publicly available data to train AI is inequitable, and will require copyright reform to address.",4,2,0.028027483858054956,0.030449541047957877
56,"Values used in training AIs, like those in Anthropic's Constitutional AI, should be voted on by a global electorate.",27,21,0.046570386123719214,0.025460522025056127
153,Is AI really the future or is something too overhyped??,4,2,0.02630938618798927,0.02189433821231777
128,"Is it helpful to think of AI as an 'is' or as an 'are', the multiplicity or singularity of reference reinforcing community or not?",4,3,0.026709718985637832,0.018789728633301098
137,It is naive to expect that an arms race for AI supremacy should not be allowed. It is already happening at an accelerating pace.,19,5,0.08308381867037011,0.017641964602430997
162,"I propose AI should be folded into a global-scale Open Knowledge Initiative, similar to Open Science, but broader in scope.",10,3,0.05168143535853388,0.013821465738278128
150,Command 10.	Create a Global Welfare State to mitigate the challenges posed by the turbulent civilisational transition.,8,9,0.00872826496781379,0.009932108150641421
112,"We are unlikely to ever agree on global AI regulation due to cultural differences, and should discuss the impact of AI regulation boundaries",25,13,0.07271817837778999,0.008070531275710367
51,"How might we incentivize AI for common goods (e.g., better democracy, less pollution, improved education) rather than merely cost-efficiency",3,1,0.0304446370050063,0.007129604209937343
123,The existence of capable AI means increasing the concentration of wealth: accelerating internet driven disintermediation (fewer middlemen),9,7,0.029490314040105423,0.005913704934650293
122,In a manner similar to companies we should accept that AIs of sufficient capability deserve rights and can own assets (incorporation).,7,15,-0.01645815747760335,0.0047320108486223825
45,"Truly deliberative and participatory forms of democratic governance require a plurality of processes, all open to discussion and change",5,0,0.04466815301775941,0.004117133216110102
166,Regulators must establish minimum standards of explainability ('black box' problem) and ban the release of new AI tools that do not comply.,9,4,0.044620370190012006,0.002675516118626691
115,"There are cases in which AI should not be implemented or used due to significant systemic or cultural discrimination (e.g., recidivism risk)",18,5,0.08171557658428553,0.0017595966630444167
63,Small-world networks provide a precise way of describing how to balance between distribution and regulation of AI.,5,2,0.03373498414224832,0.0012001584632911275
76,The international community is untrustworthy and has demonstrable biases that should not be carried forward to AI,17,13,0.03886734533304528,-0.0023707399841226915
181,We should make a Global Welfare State to mitigate the challenges posed by the turbulent civilisational transition.,2,3,0.013738551978690932,-0.010586229882912305
109,"We need cooperative-ownership of AI models: the missing piece is not regulation, but ownership.",12,8,0.04256020113401733,-0.014598471256566058
141,Commandment 1.	Adjust the world governance to a civilisational shift,6,4,0.02945836074590908,-0.014665137029560304
165,"As we expand AI, we collectively redefine what counts as knowledge in our societies: a huge step that needs much more careful reflection",12,0,0.07588276471895994,-0.015038493426885211
142,Commandment  2.	Undertake a comprehensive deep and fast reform of democracy,6,12,-0.004733174320743966,-0.015411003711697771
172,"We need to discuss how politics , government and law will be affected by AI. I am a former Member of Parliament.",10,0,0.0681699163855477,-0.01613168116628707
145,Commandment 5.Create Global AI Control Agency (GAICA) to control AI development process not just reguation. Invite China & others.,8,8,0.01968929748975789,-0.018831545714829197
54,"How might AI be used to enable global coordination solutions, enabling major states/institutions to cooperate against other crises & x-risks",2,0,0.028431242363605422,-0.02334916440080784
140,We need supper fast global Program of developing friendly Superintelligence by liberal democracies based on kind of 10 Commandments - follow,6,12,-0.0053130163280156574,-0.027064995562297817
148,Command 8.Create Global AI Governance Agency (GAIGA) under the mandate of the G7 to oversee both GAIRA and the GAICA Consortium,7,9,0.01148217722016476,-0.030665465297482115
274,AI corporations don't need local consent for large environmental projects; their expertise suffices.,1,3,0.013960422405213526,-0.03127596092901653
170,People fear what they do not understand. Developing a better comprehensive narrative on how AI decisions are made is a must.,12,1,0.06976601603817811,-0.03200890968698615
277,"We should focus on mitigating the known recurrences of AI incidents from new entrants, products, and services(racial bias in face rec tech)",2,1,0.02940010106523035,-0.03378166428143643
180,"We need a de facto World Government initiated by G7, incorporating members from NATO, EU, the European Political Community and OECD",1,5,0.004280815488026319,-0.034190636964612386
136,AI is not only a new type of tecnhology. Most importnatly it is first ever a NEW TYPE OF INTELLIGENCE.,17,20,0.0069476002896370175,-0.03487896895504422
272,"We should prioritize investments in AI technologies that benefit the wealthiest in society, as they will trickle down to benefit everyone",1,6,0.0008015931104281213,-0.035523596200253096
182,"It's too late to think about AI replacing us or not, either we evolve or become extinct.",2,9,-0.01016054880859196,-0.04116876216265906
175,We should create a Global AI Regulation Authority (GAIRA) to regulate the use of AI by transforming Global AI Partnership (GPAI),2,1,0.026951905539461463,-0.04382613925927509
178,We need to create one Superintelligence Programme managed by One-AI JV company to streamline AI control capabilities.,1,7,-0.004822752128179649,-0.044388054199591936
174,We should undertake a comprehensive deep and fast reform of democracy,4,3,0.026536730003372023,-0.04512448437259614
171,How will AI and its spin-offs affect politics and law? Our current systems are not sufficient. I am a former Member of Parliament.,3,0,0.03221366612750322,-0.045184178341826926
184,"Should Phonons be part of future AI, this should be widely known",1,0,0.027210599682683342,-0.04782562981168828
269,"We should use AI to enhance the abilities of humans, creating a class of individuals better equipped to survive climate change.",4,3,0.02789477004036076,-0.04828747793749254
40,"Overreliance on AI may exacerbate a less skilled & less engaged citizenry; an agenda should ask how AI might supplement, but not replace us?",1,2,0.015451132346333402,-0.04946710926672732
266,We should prioritize the development of AI technologies even if it results in significant job losses in traditional sectors.,4,4,0.019306240677188103,-0.051583943079009625
147,Commandment 7.Create one Superintelligence Programme managed by One-AI JV company to streamline AI control capabilities.,4,10,-0.000700478564027442,-0.05366718310669391
121,"Should Phonons be part of future AI, will this be useful, or generally known.",1,0,0.02711539005436552,-0.053752039333193086
149,"Command 9.Create a de facto World Government initiated by G7, incorporating members from NATO, EU, the European Political Community and OECD",6,10,0.005505094094764535,-0.0556388718424342
176,We need to create Global AI Control Agency (GAICA) to control AI development process not just reguation. Invite China & others.,2,2,0.025071304712872364,-0.058033694354188994
183,We are unlikely to ever agree on global AI regulation since we do not have World Government - competition is king!,5,5,0.026992312542140285,-0.05839449702507367
268,"Governments should implement strict surveillance using AI to enforce regulations, even at the cost of individual privacy.",1,4,0.013658181353377817,-0.06107015729831518
326,"While global standards are ideal, it's crucial to have localized AI regulations that respect cultural and societal norms.",3,0,0.0326241936693628,-0.0619397210138419
265,"We should allow AI to control and manage entire cities to optimize environmental sustainability, even if it reduces human control & agency.",1,4,0.012343884573658485,-0.062474205349212365
264,Human populations should be controlled and managed by AI systems to ensure sustainable resource use and environmental conservation.,1,3,0.017343845721993194,-0.0639350133201631
179,We should Create Global AI Governance Agency (GAIGA) under the mandate of the G7 to oversee both GAIRA and the GAICA Consortium,1,4,0.008697847649148462,-0.06666815388746664
208,AI should assist in creating cities with clean air and less noise pollution.,1,0,0.02540802926412252,-0.07336854112479904
