comment-id,comment-body,agrees,disagrees,quality,alignment
187,We should use AI-supported deliberative democracy to renew/update the Universal Declaration of Human Rights as an underlying constitution,1,2,0.020953699204877697,-0.07346103626045351
212,AI should help kids learn about the environment in fun and interactive ways.,6,2,0.04012542899640253,-0.07406090380375414
340,"The benefits and risks of AI systems should be equitably distributed, not concentrated among a few groups.",5,0,0.037678567027022034,-0.07453587532998263
185,Ethical philosophers who understand AI (e.g. Carissa Veliz) are a key part of the conversation,4,0,0.04180326654998034,-0.07457992876762913
279,"Companies and countries are focused on the race to AI, w/o properly considering the societal implications and governments aren't protecting",5,2,0.035313785710734846,-0.07482409711153613
173,We need to adjust world governance towards a civilisational shift,5,1,0.04413083443157505,-0.07662954168056264
151,"It is important that AI governance does not lead to confrontation between states, AI should be above politics.",15,4,0.06963037788904128,-0.07778710998340982
335,"AI should be leveraged to help monitor, model, and ultimately reduce humanity's environmental footprint.",2,0,0.033618450863450985,-0.08027060968914339
169,The epistemic risks of AI are a projection of fears of our own collective shadow. AI is a window to our collective conscious.,3,2,0.031495206896387185,-0.08067459329977714
228,It is essential to implement strict regulations that prevent AI from being used to exploit natural resources irresponsibly.,5,1,0.0450367498673069,-0.0818199250416661
4,"If we had a visual language for explaining AI systems to stakeholders, they would have more power to effect positive change.",1,0,0.02490684668408687,-0.08221935239089018
100,AI does not pose substantially different challenges to those we've already addressed in the case of other technologies or science,1,1,0.023874437020862702,-0.08399014962352061
338,"Caution and care, not speed, should guide the development and deployment of transformative AI applications.",6,1,0.049220427540313326,-0.08518311799202449
46,"Pol.is is not a deliberation platform: voting on 140 character statements is not discussion, there is no room for nuance",2,3,0.020626219435197452,-0.08638258340366745
299,Continuous risk-benefit assessments enable agile AI governance responsive to societal changes.,5,0,0.043957256156665674,-0.08668629606034267
261,AI will help us solve climate change through enabling scientific breakthroughs,7,1,0.053410224305394334,-0.08855646606783998
77,"European policy leaders are anti-immigrant, anti-semitic, and anti-American and cannot be trusted to dictate AI values",1,0,0.029426098090345368,-0.08882499872196742
75,Global coordination is infeasible because it would REQUIRE embedding authoritarian Chinese values in AI,1,0,0.03131464690822501,-0.08965711670091357
273,"Tech companies should be allowed to own and control public natural resources, leveraging AI to manage them more efficiently than governments",2,4,0.01788083207963878,-0.08988793065044676
341,"Public awareness, education, and participation around AI and the environment need to be improved.",6,0,0.054133508489641775,-0.09132709786491636
321,"AI should be in line with democratic principles, but it is not a Western democracy. It should be in line with democracies around the world.",3,1,0.03437028963078573,-0.09188479977484995
267,"AI should be used to create genetically modified organisms (GMOs) to address food scarcity, even if it means altering natural ecosystems.",1,2,0.019367808754999355,-0.094205503513519
251,"AI development should be based on the belief that nature has its own value, even without human use.",6,2,0.04027271634078068,-0.095325060015902
329,Strict data privacy regulations should be in place to protect individuals from unauthorized data collection and usage by AI systems.,4,1,0.03535881899667767,-0.09565152997804732
215,AI can help us design products that last longer and reduce the culture of throwaway consumerism.,7,1,0.05046627693811757,-0.09649784804976
177,We should create One-AI Joint Venture Company to consolidate the most advanced AI development within a single entity.,1,6,0.002933591667370788,-0.09763533586956193
327,AI technologies should strive to be as energy-efficient as possible to mitigate their environmental impact.,6,0,0.05497630569241553,-0.09858723307113852
306,AI can enhance environmental impact assessments and scenarios for sustainable policymaking.,7,0,0.05392765555405667,-0.09936933262912864
193,We should be compensated for the use of our data in AI systems.,7,1,0.05448869667286808,-0.09964496715606783
325,AI development should adhere to a universally accepted ethical framework that prioritizes human well-being and environmental sustainability.,4,1,0.03669165864265365,-0.09987663957378029
255,"AI should respect all living things, not just how they can be used for human benefit.",8,2,0.0532144719334228,-0.10014452779942816
334,AI researchers and developers have an ethical responsibility to consider the environmental impacts of their work.,6,0,0.05140500754687284,-0.10060306631819411
285,"AI can help achieve the UN Sustainable Development Goals, if developed responsibly and inclusively.",6,0,0.04895937047858999,-0.10092563441144488
191,"We should challenge statements like ""This is inevitable"".",3,1,0.03003927086287835,-0.10146998187306729
271,"We should replace local governance structures with AI systems managed by tech corporations to ensure optimized, data-driven management.",1,2,0.02043656257178232,-0.10160307956129556
155,AI is the way forward for global cooperation in international law.,4,9,0.0023677759280720015,-0.10207760224023887
226,Governments should incentivize the use of AI in developing renewable energy sources and enhancing energy efficiency.,7,0,0.05479939430909162,-0.10356782727963484
275,We must adopt a Safety By Design approach to prevent GenerativeAI tools from being used for extremist content and disinformation,5,1,0.045519801237556314,-0.1038308020439854
213,"AI must be used to support community gardens and local, sustainable agriculture.",1,1,0.028644870281098536,-0.103983473427828
240,We should encourage the development of AI tools that can help individuals reduce their personal carbon footprints.,3,0,0.035112728553017614,-0.10476541178026832
328,"AI should be developed and deployed with a focus on solving pressing societal challenges, rather than solely for profit.",3,0,0.04145966407289466,-0.10523143658537493
236,AI-driven innovations must be accessible to small and medium enterprises to foster environmentally sustainable practices.,7,0,0.058259034939340384,-0.10685673334924747
289,"AI should be designed to augment human intelligence and creativity, not replace it.",3,0,0.04182702496492218,-0.10708839294372544
216,It is important to ensure that AI does not promote harmful practices like overfishing in our oceans.,3,0,0.03608319847520761,-0.10744096116818784
333,Comprehensive life cycle assessments should be conducted for AI systems to understand their environmental footprints.,4,0,0.04694868975109982,-0.1085628492385184
322,"All entities involved in AI development should disclose the methodologies and data sets they use, to ensure ethical and unbiased AI systems.",4,0,0.04337810467247695,-0.10897607725756492
224,"AI should be leveraged to optimize energy consumption in urban infrastructures, reducing the carbon footprint.",4,0,0.04420831851187215,-0.111102653205232
337,"AI systems should promote justice, empowerment, and environmental stewardship, not just efficiency and profit.",7,0,0.052464434662214794,-0.11164402558349942
203,The financial benefits of AI should be shared with ordinary people - perhaps through a sovereign wealth fund.,9,1,0.059544802872813433,-0.11223955566906044
197,An appreciation of multiple ethical perspectives should be mandatory for all AI leaders.,7,1,0.052364806054416166,-0.11252313206933463
305,Matching renewable energy supply and demand using AI grid management will enable decarbonization.,3,0,0.04057643193186572,-0.11371256964760824
301,"AI can help optimize energy grids, reducing waste and carbon emissions.",4,0,0.04195507142147907,-0.11385460221166188
198,"The government and AI companies are responsible for poor outcomes of AI, not AI itself.",7,0,0.057891157251994126,-0.11456224033857244
300,"AI should be used judiciously in accordance with principles of justice, fairness and human dignity.",4,1,0.04306679529297054,-0.11511301879331878
219,We should prioritize the use of AI in creating affordable and green housing solutions.,5,3,0.03769278293847275,-0.11533463224539436
278,"Many blame AI for bias, yet the training data points out the existing biases in the system, therefore we should address underlying issues",4,0,0.04245303430562565,-0.11539878934883462
331,"AI development should encourage innovation & ensure the benefits are accessible to all, irrespective of geographic or economic barriers.",5,0,0.04432984812458651,-0.11555721295825494
270,We should permit the unrestricted collection & sale of individuals' personal data to fuel AI that could potentially benefit humanity.,3,2,0.027387490302089496,-0.1170976267240478
316,Robotics and automation can reduce mining impacts but may increase energy demands - requiring planning.,5,0,0.0493567124635344,-0.11822885308755812
284,Privacy risks from AI systems need to be assessed and adequately mitigated.,7,0,0.056116195593174885,-0.11851569625537137
262,AI should be used responsibly to support efforts in protecting and preserving the environment for future generations.,7,0,0.05928046753883128,-0.11873170745686341
256,"AI should help preserve the wisdom and practices of native cultures, honoring their respect for nature.",8,3,0.05082798808542245,-0.11900335481068212
339,AI should not automate or control critical environmental decisions without human oversight.,5,0,0.04698419330634389,-0.11945947679349136
311,AI can optimize smart homes and buildings for energy efficiency and occupant wellbeing.,4,0,0.046273193902325406,-0.1199888266582592
248,"AI should guide us to care for the health of our whole planet, not just human societies.",10,2,0.06206879343515921,-0.1202491749202524
168,Governments cannot fight against this huge technological revolution. They must instead adapt current systems to the new technological order.,12,5,0.05620223390923278,-0.120479483043586
318,AI can drive optimization but also increased consumption - sustainable values should guide its design.,4,0,0.04312261258594208,-0.12058568872852768
307,Satellite imagery analyzed by AI assists conservation efforts by tracking biodiversity loss.,4,0,0.04662569898772327,-0.12106085335121222
223,"AI should assist in fostering a community spirit, encouraging people to work together for a cleaner and greener future.",4,0,0.04274252696358996,-0.12332955892959525
209,We must ensure that AI technologies do not harm animal habitats.,5,2,0.03675908922392347,-0.12378805823944602
144,Commmandment 4. Create Global AI Regulation Authority (GAIRA) to regulate the use of AI by transforming Global AI Partnership (GPAI),8,12,0.007270169751356286,-0.1250024757411327
336,AI governance frameworks must include environmental representatives and consider ecological impacts.,6,0,0.05560960184612372,-0.1255876894064552
229,"AI should be used to create predictive models to help forecast natural disasters more accurately, resulting better preparedness & response",7,1,0.05652788993615886,-0.1256741624599596
312,Natural language processing of scientific texts by AI accelerates discovery of green technologies.,4,1,0.041373225879652906,-0.12584795244741695
237,We must encourage interdisciplinary collaborations that foster the symbiotic development of AI and environmental sustainability.,6,1,0.047439294879468234,-0.12621878115417579
189,One risk of AI is that it may lead to values lock-in ie it becomes impossible for our society's values and norms to evolve over time.,4,1,0.043142115460201115,-0.12735011934237414
234,It is vital to foster transparency in AI algorithms to ensure they are not contributing to environmental degradation.,8,0,0.06068017231397156,-0.12824766560191095
294,The benefits and risks of AI vary based on context - one size fits all governance is insufficient.,7,0,0.05976249859025139,-0.12832540263266343
282,AI should be developed and applied in accordance with human rights laws and values.,8,0,0.0622440557321501,-0.1284737343110795
250,"AI should help people learn about the worth of varied plants and animals, beyond what they offer to humans.",7,1,0.05535567587589675,-0.1296832047886125
298,AI requires a whole-of-society approach - collaboration between all stakeholders is key.,6,0,0.052736993875016513,-0.13058444900550242
309,Shared autonomous electric vehicles leveraging AI can complement mass transit and reduce emissions.,4,0,0.04085836252124175,-0.1306543275761604
332,"AI systems should be designed and deployed with sustainability in mind, considering environmental impacts like energy use, materials & waste",6,0,0.05123520029280691,-0.13119579883670146
239,"AI technologies should be developed to enhance the efficiency of water management systems, reducing waste and promoting conservation.",7,0,0.06055629485369592,-0.132706000376127
330,AI tech should have a comprehensive risk assessment evaluating not just the environmental impact but also societal & ethical implications.,6,0,0.055886289649900125,-0.13287389734125055
257,AI should help us to reuse and restore things more,9,0,0.06699570599813928,-0.13377705518278604
232,"AI can be pivotal in developing circular economy strategies, aiding in waste management, and promoting recycling.",5,0,0.04957247172226131,-0.13412879640139183
0,LLMs like ChatGPT and Bard should give the same answers to prompts in Pakistan as they do in California.,31,22,0.06991980841500181,-0.13573619660374958
281,"We must ensure algorithms are fair, accountable and transparent in order to build public trust in AI systems.",9,0,0.06639903570671868,-0.13610764999098196
214,AI systems should be powered by clean and renewable energy.,9,0,0.06949015996999465,-0.13830421661949782
296,"Diversity and inclusion in AI teams and data leads to better performing, safer systems.",5,0,0.05066774317632125,-0.13847199640706104
230,The deployment of AI should come with environmental impact assessments to understand and mitigate any potential harm to the environment.,10,1,0.06710279031443445,-0.13918470531236163
276,"AI technologies should be accessible to everyone, Irrespectively from their technical background",10,0,0.07243744593932833,-0.13932372757857958
188,The perspectives of plants and animals should be considered in future AI developments,5,1,0.040368399930873405,-0.13957852472352775
286,Governments should invest in digital infrastructure and AI skills training to prevent inequalities.,5,0,0.04939485107534887,-0.13970760541487431
292,"Regulatory frameworks for AI must be agile, iterative and based on evidence.",5,0,0.05157221239212617,-0.1402045638300707
59,"AIs potential to help solve major problems related to energy, health, & planetary risks make pausing AI development more risky than not.",21,19,0.038866947518090014,-0.1406724798286465
324,"The governance of AI should involve a diverse set of stakeholders, including civil society, academia, and industry.",6,0,0.052190531559289474,-0.14198448908544048
246,AI should encourage us to see and value the connections between all things in nature.,5,0,0.05176931954704216,-0.1422253791192624
195,"We want to support AI companies, but only if they bring tangible benefits to ordinary people.",6,2,0.047488136824935114,-0.1425933439233452
303,AI-enabled precision agriculture can reduce excessive water and chemical use on farms.,5,0,0.04747536433328264,-0.14283137533611134
247,"AI should help us live harmoniously with wild animals and plants, not just use them for our benefit.",10,1,0.06495242204533472,-0.1429716958378829
241,"AI can be a tool in the fight against illegal activities that harm the environment, such as poaching and illegal logging.",6,0,0.05431670759924325,-0.14431790703613429
253,"AI tools should encourage us to view the environment and its creatures as a community we are a part of, not just resources to use.",9,1,0.060960787848250576,-0.14456140743554513
245,"AI should be developed with respect for all living things, not just focusing on humans.",10,0,0.06821783109976692,-0.14498387192302764
119,"AI will enhance equity and inclusion, within a context of community value,  improving human responsibility",7,11,0.010242475819017835,-0.14503404901142053
313,AI-driven sensors and drone analytics empower precision forestry and regenerative agriculture.,5,0,0.05311956912237079,-0.14537984415499938
225,AI developers must work in tandem with environmental scientists to ensure that AI technologies are sustainable and environmentally friendly.,5,0,0.051807560190578666,-0.14567130359903155
243,Open-source AI technologies can foster collaborative efforts globally to address environmental challenges more effectively.,9,0,0.06318079905872298,-0.14588832287980147
290,Effective public consultation can guide responsible AI innovation that serves societal needs.,7,1,0.05652478325851997,-0.1461760331183235
199,We should have safeguards and rules rather than guard rails.,6,0,0.05015702983834976,-0.14670912754943088
319,"To realize sustainability benefits, AI deployment must respect nature and human dignity.",6,0,0.05475323012396084,-0.14695394132518924
323,"There should be a concerted effort to educate the public about the capabilities, limitations, and ethical considerations of AI.",8,0,0.06181245808998116,-0.14771620706723887
192,"Whether governments or corporations, the people who take decisions on AI should take responsibility for them.",8,0,0.06469152783619506,-0.14774694133413813
159,"Inter-state/national AI forums should focus first and foremost on applications in defense and warfare, before moving on to other concerns.",1,8,-0.004496887702047989,-0.14816412557918857
314,AI could help fairly allocate environmental resources and pollution credits.,6,0,0.05197088015902754,-0.14859263787455584
207,We should be careful that AI doesn't lead to more electronic waste,9,1,0.06125486190798636,-0.1494910284406138
205,AI should be used to help farmers grow food in ways that are kinder to the earth.,6,0,0.0562272931799659,-0.1500780554879456
283,"Humans should remain in control of autonomous weapon systems, not cede lethal decisions to AI.",8,0,0.062130554288794285,-0.151542345793653
98,We should be more worried about AI arms races between corporations than ones between governments.,10,14,0.012375591052151075,-0.15189560608351843
295,Governments must expand access to data while protecting privacy to enable AI for good.,6,1,0.05312285843099232,-0.1526692950235685
211,"AI can help us make better use of water resources, avoiding waste and saving water for the future.",6,0,0.05312069063723901,-0.15344094424344515
260,"AI should operate on a rule of not harming the environment, respecting the rights of all beings and ecosystems.",14,0,0.088867912157731,-0.15408284346796525
227,AI applications in agriculture should prioritize sustainable farming practices to help mitigate climate change.,5,0,0.04855243172894935,-0.15427659644039135
238,Leveraging AI for environmental education can foster a society that is conscious and proactive about environmental conservation.,6,0,0.05580922208216839,-0.15466331808659622
259,"We should use AI to question practices that see nature only as a source of profit, ignoring its own value.",10,0,0.07344775201810555,-0.1549591917637027
254,AI should encourage us to value ecological balance and the wellbeing of all species over constant growth.,6,0,0.05583127157838071,-0.1552678165571928
244,"AI should help us value all life forms for their own sake, not just for what they can do for humans.",9,1,0.06288061657443944,-0.15558142198031788
186,We should split the conversation into (1) how to minimise/prevent harm to democracy and (2) how to maximise benefits to democracy,7,0,0.061083800276767033,-0.15614867365821494
202,The impact of AI on the natural world has not been considered enough.,9,1,0.06613335887066857,-0.1564999212469853
263,AI technologies should be developed with a focus on reducing their own environmental impact over their lifecycle.,8,1,0.05675505075087105,-0.15675987635953342
231,It is crucial to promote the development of AI technologies that can aid in the conservation of biodiversity.,11,0,0.07913601138730132,-0.15676363436255003
293,AI should not be used by companies to nudge or manipulate people against their best interests.,6,0,0.05099673873562413,-0.1586498647363454
308,"AI-based early warning systems can alert communities to pollution, wildfires and other threats.",7,0,0.05498949136577115,-0.15929242456782028
218,AI should be created and used in a way that respects the rights and cultures of indigenous peoples.,8,0,0.06271254317114666,-0.16030850092007756
320,Global cooperation on AI governance is crucial to manage environmental transformations ahead.,7,0,0.05571218736403959,-0.16032286149502656
222,AI can help us in making transport greener,9,1,0.060193316616436475,-0.161954512127503
204,We should use AI to help people understand how their daily choices can affect the environment.,4,1,0.04147941562022436,-0.16397653805635817
139,"Anonymous said 'Agenda should ask how AI might supplement, but not replace us'. It's too late, either we evolve or become extinct.",6,9,0.017297634612063607,-0.16413511598791836
302,Intelligent transport systems powered by AI can make mobility more efficient and sustainable.,7,0,0.062394116534133306,-0.16684122982268867
252,AI should help us understand and respect the relationships between different elements in nature,7,0,0.06282263276840562,-0.16735089603448267
220,AI should help us in coming up with creative solutions to reduce pollution in our rivers and oceans.,8,0,0.06185730804558322,-0.16764198902123412
233,AI should be designed with energy efficiency in mind to reduce its carbon footprint and promote a healthier environment.,5,2,0.039742692435082896,-0.16843751122592615
249,We should use AI to question the idea that all technology is good and consider how it might harm nature and animals.,11,1,0.07326916688342326,-0.16917399532513777
317,"AI has potential environmental risks we must monitor and mitigate, like energy usage and e-waste.",8,0,0.061324935739873694,-0.16943667654359373
310,Synthetic biology guided by AI may lead to breakthroughs like low-carbon cement and plastic alternatives.,7,0,0.05660200600987793,-0.17087516480065396
194,Our permission should be sought to use our data in AI systems.,8,0,0.06206925468371464,-0.17096266605847726
217,AI can assist in monitoring and maintaining the health of our forests.,7,0,0.06219152120361092,-0.17118954140892267
190,"There should be a principle of ""keeping humans in the loop"" when it comes to decision making and AI.",7,0,0.06090783071086399,-0.17202090490586383
138,We are unlikely to ever agree on global AI regulation - said anonymous. Agree since we do not have World Government - competition is king!,5,6,0.02466598852952308,-0.17274895917972785
291,AI actors should adopt mechanisms for redress in case of harm from AI systems.,11,0,0.07791484437722976,-0.17301705366018022
288,We must continually reassess AI systems for unintended consequences as they interact with society.,9,0,0.06815376511295629,-0.17549956057311675
304,AI tools can empower citizens to monitor environmental quality and defend ecological rights.,8,0,0.06481945707353773,-0.1792103780328107
201,"I want to live in a functioning democracy, where we all have a say about big changes that affect us, & AI works for us - not corporations",12,1,0.08092998645183833,-0.18546736987146664
315,AI modeling of extreme weather helps societies build resilience and adapt to climate change.,8,0,0.0626409886088432,-0.1867678279604011
258,AI should help us create rules that prioritize the health of ecosystems over making money.,10,0,0.06947945812646436,-0.18702536368367287
221,"It is crucial that AI does not make the rich richer while forgetting about the poor, especially in environmental solutions.",8,0,0.06741206806971983,-0.18739832284398397
297,We need stronger digital security to prevent attacks on AI systems that could cause social harm.,9,0,0.07110846912442972,-0.19102743023119936
210,It is important to use AI to protect endangered species from threats like poaching.,8,0,0.062245988299494334,-0.19236005797853167
146,Commandment 6.Create One-AI Joint Venture Company to consolidate the most advanced AI development within a single entity.,2,11,-0.012278446954122602,-0.19273465842071075
39,"It is moral to use the threat of war to constrain development of AI, just like we use the threat of war to constrain nuclear development",17,23,-0.0011312307826424112,-0.19455681151203616
130,"Quite soone we may have AGI, which would be more intelligent and smarter than any humans. It will be AI which will decide on resources.",4,10,0.003588610077837659,-0.1971830221925751
88,"Artificial general intelligence is likely to be created before 2030, assuming business-as-usual (no major regulation, no new major wars).",10,26,-0.041561996525352835,-0.1983984253141249
242,The global community should work together to ensure that AI advancements are harmonized with the Sustainable Development Goals (SDGs).,10,0,0.07560860949905379,-0.20046568834827408
287,International standards are needed to ensure AI actors adhere to ethical principles.,11,0,0.08161783181343912,-0.20238383721356845
235,"AI should be employed to enhance public transportation systems, reducing traffic congestion and lowering greenhouse gas emissions.",10,0,0.0766076596330593,-0.20623758065081604
