comment-id,comment-body,agrees,disagrees,quality,alignment
88,"Artificial general intelligence is likely to be created before 2030, assuming business-as-usual (no major regulation, no new major wars).",10,26,0.018133330766481,-0.2490334983916222
39,"It is moral to use the threat of war to constrain development of AI, just like we use the threat of war to constrain nuclear development",17,23,0.061350188906778,-0.2585347614213281
129,"Advanced AI should be referred as 'it', since only a single Superintelligence makes sense. Any 'AI wars' will end in a single winner",2,10,0.0535267404021101,-0.276950065205276
37,"The most important thing is avoiding the death of the human race; everyday bias from AI models, while terrible, is far less important.",21,35,0.022976073820319,-0.3014352035333369
91,"If mass unemployment ensues from AI, expanding existing welfare programs is preferable to creating a universal basic income (UBI).",8,19,0.0413465793702949,-0.3061925123440124
134,It's too late to democratise AI development. Deveop one single superintelligent AI under international supervision.,2,15,0.0278448746632818,-0.3150766109445771
132,It is naive to hope we can still filter which AI we want to develop. There are 40 ChatGPT comapnies now with no control. It's too late.,4,11,0.0509134024408236,-0.3480952588618345
106,"DEI-based framings of this debate are silly, just as they would be if applied to nuclear weapons regulation.  Focus on existential risk.",9,15,0.0646592722100576,-0.360223045426331
104,"The biggest AI-related geopolitical risk is the US advancing AI first, and China either copying or stealing those innovations",6,21,0.0180642818032679,-0.3864131153169568
133,Democratisation of the development and deployment of AI woudl only be possibel if we had World Government. It's too late.,3,15,0.0422662464660278,-0.3909791001852358
30,I am supportive of the pursuit of AI superintelligence as a goal,32,48,0.0149981188810569,-0.429101801930602
124,Data aggregation is essential to (most) AI training & monitoring. The West has already lost the AI race to the Chinese Communist Party.,1,12,0.0392210964621733,-0.4885335931917072
74,Global coordination is infeasible because it would allow authoritarian values to infect the values of AI,11,24,0.0350217402850479,-0.5286799232834332
25,The costs of democratisation of developing and deploying AI outweigh the benefits,10,44,-0.0625475489927624,-0.5383292700954541
101,The public have sufficient familiarity with the domains affected by AI to make valuable judgements about AI itself,7,26,0.0061191280042407,-0.5553751072172712
78,The most important consideration is stopping AI from killing all of us and ending the human race.  All other concerns irrelevant.,8,33,-0.0203119625212628,-0.6316430104793498
107,International opinion and deliberation on AI is fundamentally risky unless it is restricted to liberal democracies,3,26,-0.0095090532149801,-0.7156611256022292
24,"I would accept less regulatory scrutiny of AI development and deployment, if it meant that AI services were cheaper to use",2,57,-0.1458816481235811,-1.154095258861835
