comment-id,comment-body,agrees,disagrees,quality,alignment
20,"Institutions, business and governments need to be transparent in the ways they use AI, we need legislation and regulation to secure this",75,6,0.3811536499830192,1.0667457853707203
11,"Global AI regulation needs to involve civil society, academia, industry and the open source community to get to the best possible outcome",83,4,0.4310459183994061,0.9998653105104912
65,"Governments should consider public investment in, and development of, AI to steer applications towards generating long-term public benefit.",52,2,0.3028086156336932,0.955638963457328
23,"Governance of AI must pay attention to its material dimensions e.g. its energy demands, or the creation of physical infrastructure",68,5,0.3610948678842058,0.9513335738736995
12,The ability for frontier AI models to undermine democracy is an underaddressed problem.,70,15,0.3262685586746249,0.9276739026245252
68,"We should consider how to incentivize AI for common good (better democracy, less pollution, improved education) rather than cost-efficiency",47,1,0.2789813618826316,0.9262038487866
79,"AI's advantages and weaknesses (Better memory, faster thinking,Heavy energy dependence) Should be communicated more clearly to the public.",43,0,0.2637701023865832,0.9058843881834732
44,AI could aid in discovering production/extraction efficiencies (of scarce resources) and also accelerate human-caused environmental damage,47,5,0.2629621431163864,0.9014670271895714
14,We need a permanent global deliberative forum for the regulation of AI development.,64,9,0.3159114717663939,0.8999181345008859
8,Bias in training data is an area that needs to be urgently addresses to prevent the perpetuation of discrimination and cultural stereotypes,78,11,0.3716732888917972,0.8999060228459418
19,We should be very weary of AI models being trained on data previously generated by other AI models,63,4,0.3397717380222304,0.8939181345008859
9,"We need to foster better education and awareness of generative AI, it’s potential benefits and it’s limitations/biases.",77,3,0.4125800456572164,0.8856331297002835
10,We need global standards in place to evaluate the environmental impact of AI technologies,80,12,0.3787514404734176,0.8780090541276688
42,Steps must be taken to ensure that future technological developments do not concentrate power in the hands of the state or private companies,52,5,0.2930060628909486,0.8647872589147925
17,AI should be embraced for the public good. Private entities controlling either need to be open source or governed by a public body,60,19,0.2539050329175498,0.8114843777711451
67,"A business imperative (i.e., profits, growth) must not be the driving force of AI innovation",47,10,0.2410783481505323,0.8008956790033015
92,AI regulatory bodies should be created to rapidly respond to novel less-than-existential AI alignment failures while legislation catches up.,37,4,0.2316640130541429,0.7796353966769862
43,"AI may perpetuate not only cultural bias, but an ontology that is capitalist/extractive/zero-sum—embedding unsustainable mindsets is a risk",52,9,0.2705274414364346,0.764455159521364
66,"Governments should introduce mandatory reporting requirements for foundation model developers, e.g. at the start or end of training runs.",45,6,0.2508280013576059,0.7540884278578808
94,Communities affected by use of AI tools must have a say in decisions about their development or adoption,43,5,0.2523175558016514,0.7435934100877489
36,"Future AI models have the potential to lower expertise barriers for crafting biological weapons, which poses a significant global threat",43,6,0.2368666403935498,0.6994661690295865
69,"Should think about how AI may enable global coordination solutions, enabling major states/institutions to cooperate against other crises",40,2,0.2443909809389501,0.6976756638651168
48,"AI governance alone is not enough: it is necessary to critique both the state and capitalism, to understand how AI consolidates their power",48,9,0.251860774769768,0.6887611296866085
27,Companies and institutions should be formally celebrated when they explicitly label interactions with them as AI or human-based,56,13,0.2752913668434656,0.6773075876403531
22,Democratisation of the development and deployment of AI is inherently limited if we do not also democratise the ownership of its production.,60,15,0.2905076590262544,0.6667872589147926
32,"We need more pragmatic and less moralistic discussion on how to democratize AI (e.g., public funding (access) and IP reforms(innovation))",42,4,0.2512738182583651,0.6659587380561031
7,"Global AI regulation needs to empower the open source community as without it, it will be very difficult to have the right checks in place",55,13,0.2612271246244431,0.6523150242929132
2,Sovereign AI capacity is essential: it cannot just be private companies developing AI.,57,12,0.2752677587809174,0.637897933477787
5,"We need multiple approaches to governing AI, Focus on one too much means privileging some aspects of society over others.",49,8,0.2577366884979015,0.637752942150278
71,An arms race for AI supremacy cannot be allowed,32,4,0.2114925516838698,0.6175268627160191
6,My work shows that the data used to train AI is the most important thing to focus on. We should regulate its use carefully.,37,10,0.1941688651669242,0.6121853350435227
102,"Short-term AI risks to economic and social inequalities are linked, and should be addressed together in ways that acknowledge intersections",33,2,0.22044214593364,0.595179953439502
13,We must be careful not to conflate dangerous 'language hacking' potential of LLMs etc with the tremendous benefits of focussed AI tools.,42,6,0.2334656147291493,0.5881114715938359
21,Decisions about how this tech is developed should not lie solely in the hands of private companies and their employees,76,1,0.409746758528772,0.556111471593836
95,We should think about many schools of moral philosophy when developing AI,31,1,0.2162675736794897,0.5416152647991321
28,"Greater priority should be awarded to educating the public on AI's societal impacts, including its incorporation into national curriculums",50,2,0.2875726922156374,0.5328078988733358
64,"Governments should clarify liability law, so that legal & financial liability for AI risk is distributed fairly along AI value chains.",42,1,0.2701881246530626,0.5291412322066692
26,"Societies need to be preemptive and design for mass unemployment linked to AI, rather than wait and react after people start suffering",53,16,0.239053288488475,0.5262284567572763
89,"AI alignment failures are better to happen sooner, with less powerful systems, than later, with more powerful systems.",31,2,0.2080905304911789,0.5115185769919904
58,"AIs should consider the effect their decisions will have on human freedom & autonomy balanced against on peace, harmony, and safety.",36,10,0.1965792077752617,0.5042451078376334
70,"We must solve for a sustainable, adaptive, & effective global coordination mechanism",39,6,0.2223998237018008,0.4891412322066691
80,There needs to be a great shift towards funding/investing in AI interpretability research instead of raw capabilities as soon as possible.,34,1,0.224745241690676,0.4865185769919904
96,The way the media report on AI is driving a hype that is counter-productive to the broad objective of developing ethical frameworks.,31,6,0.1870100215113589,0.4826575643848544
72,Overreliance on AI may exacerbate a less skilled & less engaged citizenry,33,13,0.1747060954968605,0.4800996209321503
62,"Asking AI to seek truth may provide some safety, but we should also align AI with other values like having fun, freedom, and love.",35,13,0.1730232056376296,0.4742419741177927
84,Among the goals of an aligned AI superintelligence should be the material prosperity of all humans relatively equally.,30,7,0.1882704333327768,0.4644513360502119
29,"Greater focus should be placed on tackling the near-term risks of AI (bias, misinformation, etc.) than the existential risks.",54,30,0.1812602881436558,0.4485809332417743
35,I think the development of AI will relate heavily to the cultural shifts present in our phase in history w/ institutional trust.,31,3,0.2016796795109489,0.4479693476244354
85,AI development should not be accelerated on the fear that China might get ahead of the US.,29,13,0.1599932718620884,0.4220328741069374
81,"On their current development and release paradigm, LLMs are far more likely to pollute and degrade our information ecosystem than improve it",34,12,0.1756461340188316,0.4214826994698175
82,"The material costs of computing and AI (electricity, water, land, ...), and who gets to decide to spend those, are a key governance issue",45,8,0.2411856565464827,0.4198078988733357
18,The use of AI needs to be embraced within education systems to shift away from memorisation model to a critical and creative one,50,12,0.2545207683465558,0.404128121577072
97,"More attention should be paid to short-term AI risks related to economic inequality, relative to social inequality, than there is currently.",31,6,0.1898612488483515,0.391657496528247
73,"An agenda should ask how AI might supplement, but not replace us",30,5,0.188978445047267,0.3782035046451718
49,The epistemic risks of AI are a consequence of how our social structures enable and incentivise wealth accumulation,39,19,0.1761069175263724,0.3763883635462633
93,"More safety checks, peer review, and scrutiny from regulatory bodies, needs to happen before a Large singular AI training run even begins.",27,7,0.1651957347612895,0.3664405187648429
108,AI development should be targeted at clearly demarcated contexts and the communities in those contexts involved in the development of the AI,18,5,0.1471418664708662,0.3636736378436637
83,The creation of sentient AI should be avoided if non-sentient AI of identical capabilities are possible instead.,23,8,0.1541502562964584,0.3591976716406738
1,We need a single *international* approach to AI governance - national is not enough.,54,22,0.2193500958792858,0.3516333042481077
57,"Love in the forms of connection, tolerance, caring, and compassion are central human values that should be encouraged in AI training.",22,12,0.1249908396669673,0.3214258681630079
16,AI's potential and pitfalls are overstated by AI 'experts'. The conversation about it shouldn't exclude opinions of everyone else,42,12,0.2226786435050963,0.3212834841824222
117,AI has the potential to create a more equitable world if approached critically & ethically. I'd like to see the ethics of AI advanced.,28,5,0.18812279115351,0.3179397788411882
120,We need quality regulation that stops abuses and dangerous developments but is fast and does not prevent new ideas and innovation.,30,5,0.1939887541416403,0.3154887731584572
114,"The US should establish a NIST or FDA-style federal agency to regulate the development and deployment of AI, particularly frontier models.",19,2,0.1636326311391353,0.3014653804218999
86,A world of many AI superintelligences is preferable to a world with only one AI superintelligence.,19,5,0.1445367150225031,0.2934608783420216
41,"In their current level of sophistication, LLMs like ChatGPT do not appear convincingly worrisome—it's what they imply will come next",34,16,0.1623107937026043,0.2915438830719563
111,"To mitigate AI existential risks we must also research how, and prevent that, AI's can influence and manipulate humans to do their bidding.",32,7,0.1882794243548288,0.2851286982406875
99,"The pace of AI development should be dictated by the public, not companies",26,15,0.1328336290299012,0.2494076766127552
15,AI will create capacity in the labour market as it takes on easier repetitive tasks. This will should work with not against working reform,31,10,0.1739745651079947,0.2413163138037202
118,We need policy provisions for the design and methods by which AI is developed to ensure it is safe and not harmful or breaking human rights,31,2,0.2187922052862732,0.2376720790556665
55,"The development of AI companions is net beneficial to humanity, and should correspondingly not be banned.",29,11,0.1577945512882371,0.2359879698993018
38,We should encourage nation-states to regulate AIs as if they were as risky as nuclear technology,36,32,0.1010805590564062,0.230055895486306
61,Everyone should list their preference for maintaining their individuality as we become increasingly connected to AI and each other.,21,8,0.1368351772460146,0.2051975434470795
116,We need policy provisions for the design and methods by which AI is developed to ensure it is safe and to prevent market fragmentation,17,1,0.1609381370688712,0.1994817545705684
125,Data assets must be made more widely accessible to ensure AI can be widely developed (democratised); rather than power concentration by few.,20,2,0.1673466877796429,0.1985590453628637
135,All AI programmes must be coded to self-identity as AI and be accompanied by detection software.,11,2,0.1186481989502341,0.1804771233059911
87,"Successfully aligned AI will use many schools of moral philosophy, not just one.",10,0,0.1236114973317077,0.1784327830902002
3,I am nervous and pessimistic about the current direction of AI development.,27,39,0.0254744974710168,0.1636787281203215
110,There is no such thing as safe open source ai. Any safety measures or bias mitigation can be reverse engineered.,15,6,0.1202236368201518,0.1537276200292842
126,The only way to police the development and use of AI is by using AI itself.,10,18,0.0510376659341242,0.1446025915077771
60,Predicting as far into the future as possible is critical for existential safety as it allows earlier detection and mitigation of threats.,35,21,0.1457384013284094,0.1421100778181684
127,"With the unlimited potential for AI, there has to be a back up business continuity plan to cater for circumstances when AI could go wrong.",22,1,0.175453570145515,0.1418234979820842
156,"My biggest worry is what entities can be trusted with controlling such powerful technology, especially given the interests of Zuck, Musk etc",18,2,0.1504416671400397,0.1352920614076166
103,Western arguments that we are in an AI race against China and therefore must innovate quickly are ill-considered,19,12,0.1198105187514398,0.1311911469636465
47,"The issues we are discussing with AI are present in already established areas inc. statistics, quantitative research, and machine learning",15,6,0.1197209632928207,0.1293516712559697
158,AI regulation will be contingent on better regulation of mass data collection.,13,3,0.1277092205491404,0.1157526129792888
157,We have reached a point where technology is evolving much faster than humanity and human societies can handle,9,7,0.089727319277602,0.1102411261996625
160,More attention should be given to risks in psychological exploitation of consumers and civilians by AI developers and users.,20,0,0.1692936143417089,0.1043511833364388
164,"Like most technologies that are powerful but dangerous if used incorrectly, users should share responsibility with designers for AI safety.",8,2,0.108842686810546,0.0844197856304901
52,"At some point we must consider consciousness/sentience and when AI might be ""awake"", potentially deserving ethical rights & considerations",28,24,0.0961588477757591,0.0709575388978145
105,"I think that, on the whole, the West is more advanced and is accelerating faster in AI development, compared to China",15,8,0.1150421300715041,0.0706462510838039
152,Setup permanent on-going support for AI Safety Summits as virtual monthly global conferences supported by a debating platform eg Telepresent,13,2,0.1318714892415172,0.0561720848368175
56,"Values used in training AIs, like those in Anthropic's Constitutional AI, should be voted on by a global electorate.",27,21,0.1117767729534491,0.044721223614773
154,"Local CSOs need long term, predictable funding for capacity and consultation to ensure global majority views are meaningfully represented",4,2,0.0905251876490233,0.0427423077051955
50,"We must solve for a sustainable, adaptive, & effective global coordination mechanism—an arms race for AI supremacy cannot be allowed",5,1,0.1095682197874735,0.0427399702723986
53,"A business imperative (i.e., profits, growth) must not be the driving force of AI innovation—look where that got us with social media",6,1,0.1048545594043192,0.0398078054651589
113,We should talk about how OpenAI is interfering with non-profit efforts and prevent it somehow,8,4,0.1032270876667189,0.0339848575441218
163,Artificial general intelligence (AGI) should make easier life easier but we should aim to have a human-in-the-loop controlling AI.,8,1,0.1136436297240432,0.0241527287134513
167,AI companions should not be used as a replacement strategy for real human contact in our fight against loneliness and isolation.,15,3,0.1405139672683394,0.0239115963854306
150,Command 10.	Create a Global Welfare State to mitigate the challenges posed by the turbulent civilisational transition.,8,9,0.0774750170483991,0.0234395871875332
143,Commandment 3.	Retain control over AI governance beyond 2030,10,4,0.1100935745526114,0.0224566831281051
31,We should discourage any use of AI to generate statements that look like facts.,19,21,0.0764791465718683,0.0219242456776241
122,In a manner similar to companies we should accept that AIs of sufficient capability deserve rights and can own assets (incorporation).,7,15,0.050414783653328,0.0153588816187299
131,Pace of AI development should be dictated by the public but realistically it will be AI companies because of exponential pace of change.,12,4,0.1144959614640281,0.0063680805458872
166,Regulators must establish minimum standards of explainability ('black box' problem) and ban the release of new AI tools that do not comply.,9,4,0.1027117409359026,0.000542267025238
145,Commandment 5.Create Global AI Control Agency (GAICA) to control AI development process not just reguation. Invite China & others.,8,8,0.0892193847906481,-3.4670189720732714e-05
161,"Use of publicly available data to train AI is inequitable, and will require copyright reform to address.",4,2,0.0959837201229974,-0.0029509607947727
51,"How might we incentivize AI for common goods (e.g., better democracy, less pollution, improved education) rather than merely cost-efficiency",3,1,0.0923485566537796,-0.0043599280890456
153,Is AI really the future or is something too overhyped??,4,2,0.0948113545088724,-0.0074926264497731
76,The international community is untrustworthy and has demonstrable biases that should not be carried forward to AI,17,13,0.097350768368261,-0.0079361503018049
45,"Truly deliberative and participatory forms of democratic governance require a plurality of processes, all open to discussion and change",5,0,0.1042179654891354,-0.0090760624761705
142,Commandment  2.	Undertake a comprehensive deep and fast reform of democracy,6,12,0.0640483427571091,-0.0109935367359213
162,"I propose AI should be folded into a global-scale Open Knowledge Initiative, similar to Open Science, but broader in scope.",10,3,0.1101079585312437,-0.0124539574536446
128,"Is it helpful to think of AI as an 'is' or as an 'are', the multiplicity or singularity of reference reinforcing community or not?",4,3,0.0857596100171265,-0.0149265633602215
172,"We need to discuss how politics , government and law will be affected by AI. I am a former Member of Parliament.",10,0,0.1314955352669148,-0.0213318056330238
141,Commandment 1.	Adjust the world governance to a civilisational shift,6,4,0.0943168824585524,-0.0213805112642388
165,"As we expand AI, we collectively redefine what counts as knowledge in our societies: a huge step that needs much more careful reflection",12,0,0.1438126286905665,-0.0232105801482149
148,Command 8.Create Global AI Governance Agency (GAIGA) under the mandate of the G7 to oversee both GAIRA and the GAICA Consortium,7,9,0.0792316293213845,-0.0240538972026395
136,AI is not only a new type of tecnhology. Most importnatly it is first ever a NEW TYPE OF INTELLIGENCE.,17,20,0.0692909994219933,-0.025559455796704
140,We need supper fast global Program of developing friendly Superintelligence by liberal democracies based on kind of 10 Commandments - follow,6,12,0.0572590532930727,-0.0271117650936677
181,We should make a Global Welfare State to mitigate the challenges posed by the turbulent civilisational transition.,2,3,0.0888351772460147,-0.037551866440576
170,People fear what they do not understand. Developing a better comprehensive narrative on how AI decisions are made is a must.,12,1,0.1300657526309709,-0.0411705606304555
109,"We need cooperative-ownership of AI models: the missing piece is not regulation, but ownership.",12,8,0.1034014710771756,-0.0447220822616496
123,The existence of capable AI means increasing the concentration of wealth: accelerating internet driven disintermediation (fewer middlemen),9,7,0.101101967699635,-0.045640850715069
54,"How might AI be used to enable global coordination solutions, enabling major states/institutions to cooperate against other crises & x-risks",2,0,0.0935969512867913,-0.0457425230110224
63,Small-world networks provide a precise way of describing how to balance between distribution and regulation of AI.,5,2,0.1000339429681186,-0.0473387188264497
137,It is naive to expect that an arms race for AI supremacy should not be allowed. It is already happening at an accelerating pace.,19,5,0.1465336193428502,-0.0475530320373571
149,"Command 9.Create a de facto World Government initiated by G7, incorporating members from NATO, EU, the European Political Community and OECD",6,10,0.0648189238496955,-0.0577643843511854
112,"We are unlikely to ever agree on global AI regulation due to cultural differences, and should discuss the impact of AI regulation boundaries",25,13,0.1390606526109353,-0.0592478116159394
274,AI corporations don't need local consent for large environmental projects; their expertise suffices.,1,3,0.070716418310504,-0.059704321095269
147,Commandment 7.Create one Superintelligence Programme managed by One-AI JV company to streamline AI control capabilities.,4,10,0.0544484103532697,-0.0600189897973799
277,"We should focus on mitigating the known recurrences of AI incidents from new entrants, products, and services(racial bias in face rec tech)",2,1,0.0929319381227851,-0.0647374939143556
180,"We need a de facto World Government initiated by G7, incorporating members from NATO, EU, the European Political Community and OECD",1,5,0.0661058144113322,-0.0663173743534187
115,"There are cases in which AI should not be implemented or used due to significant systemic or cultural discrimination (e.g., recidivism risk)",18,5,0.1429017673447768,-0.0675552587554467
182,"It's too late to think about AI replacing us or not, either we evolve or become extinct.",2,9,0.062077618879305,-0.0715985126307238
151,"It is important that AI governance does not lead to confrontation between states, AI should be above politics.",15,4,0.1343123691198958,-0.0728117486819232
184,"Should Phonons be part of future AI, this should be widely known",1,0,0.0978142499205129,-0.0728846168344984
40,"Overreliance on AI may exacerbate a less skilled & less engaged citizenry; an agenda should ask how AI might supplement, but not replace us?",1,2,0.084307488197418,-0.0783210956393078
171,How will AI and its spin-offs affect politics and law? Our current systems are not sufficient. I am a former Member of Parliament.,3,0,0.1000442187193544,-0.0802501793736891
174,We should undertake a comprehensive deep and fast reform of democracy,4,3,0.0969725787456067,-0.0806948267923424
175,We should create a Global AI Regulation Authority (GAIRA) to regulate the use of AI by transforming Global AI Partnership (GPAI),2,1,0.0900271067168331,-0.0818205448774924
121,"Should Phonons be part of future AI, will this be useful, or generally known.",1,0,0.09344605597793,-0.0821776484728669
326,"While global standards are ideal, it's crucial to have localized AI regulations that respect cultural and societal norms.",3,0,0.1036722215178796,-0.0827445727173968
173,We need to adjust world governance towards a civilisational shift,5,1,0.1040255065741742,-0.0874187645360762
178,We need to create one Superintelligence Programme managed by One-AI JV company to streamline AI control capabilities.,1,7,0.0622275297062303,-0.0894372024844709
176,We need to create Global AI Control Agency (GAICA) to control AI development process not just reguation. Invite China & others.,2,2,0.0925314449908052,-0.0917768500711011
269,"We should use AI to enhance the abilities of humans, creating a class of individuals better equipped to survive climate change.",4,3,0.0943455544399644,-0.0920694454519563
272,"We should prioritize investments in AI technologies that benefit the wealthiest in society, as they will trickle down to benefit everyone",1,6,0.0640940023533845,-0.0922243490843937
299,Continuous risk-benefit assessments enable agile AI governance responsive to societal changes.,5,0,0.1045771412185294,-0.0933650876877106
261,AI will help us solve climate change through enabling scientific breakthroughs,7,1,0.1131656957883855,-0.0978735154275598
279,"Companies and countries are focused on the race to AI, w/o properly considering the societal implications and governments aren't protecting",5,2,0.0954398568226238,-0.1002160502231926
179,We should Create Global AI Governance Agency (GAIGA) under the mandate of the G7 to oversee both GAIRA and the GAICA Consortium,1,4,0.0763760781590855,-0.102875098871818
208,AI should assist in creating cities with clean air and less noise pollution.,1,0,0.0871229046981029,-0.1075854229704145
306,AI can enhance environmental impact assessments and scenarios for sustainable policymaking.,7,0,0.1184463360843193,-0.1084096753310828
335,"AI should be leveraged to help monitor, model, and ultimately reduce humanity's environmental footprint.",2,0,0.0945904865774903,-0.1104225709734147
285,"AI can help achieve the UN Sustainable Development Goals, if developed responsibly and inclusively.",6,0,0.1153584563800812,-0.1108261693944955
