comment-id,comment-body,agrees,disagrees,quality,alignment
280,"To promote responsible AI, Companies, countries, and governments should be doing more to educate and inform consumers and end users.",12,0,0.0836281124173527,-0.2150049139071551
206,AI tools should help us recycle better by sorting waste more accurately.,9,0,0.07188833520865073,-0.217777359676326
34,The use of AI in external and internal facing tools should be regulated differently.,17,15,0.035889083974417924,-0.22222198030286688
196,"Governance and regulation should match risk. If there is strong risk, there should be strong governance and regulation -  and vice versa.",11,0,0.0775112001441484,-0.22356056564270285
200,"AI can benefit us all, if it is shaped in our interest.",8,2,0.05490148775847496,-0.2238903782227232
33,Regulation of AI should be different for companies of different sizes.,25,24,0.03167462860392954,-0.22867453886608172
129,"Advanced AI should be referred as 'it', since only a single Superintelligence makes sense. Any 'AI wars' will end in a single winner",2,10,-0.006194904213253713,-0.23049357525208317
90,"An AI development pause is good for its own sake, even if the time is not used by governments to debate or enact regulations.",12,25,-0.025700795646585565,-0.24272191790088868
106,"DEI-based framings of this debate are silly, just as they would be if applied to nuclear weapons regulation.  Focus on existential risk.",9,15,0.00964482270030192,-0.2916827704540107
132,It is naive to hope we can still filter which AI we want to develop. There are 40 ChatGPT comapnies now with no control. It's too late.,4,11,0.004834885917841238,-0.2924590443497487
134,It's too late to democratise AI development. Deveop one single superintelligent AI under international supervision.,2,15,-0.025397671613507537,-0.2965895592812515
104,"The biggest AI-related geopolitical risk is the US advancing AI first, and China either copying or stealing those innovations",6,21,-0.033675834480827685,-0.3157757655126423
30,I am supportive of the pursuit of AI superintelligence as a goal,32,48,-0.03727856257952496,-0.32194966808648545
133,Democratisation of the development and deployment of AI woudl only be possibel if we had World Government. It's too late.,3,15,-0.018231098824111277,-0.32411735120156887
91,"If mass unemployment ensues from AI, expanding existing welfare programs is preferable to creating a universal basic income (UBI).",8,19,-0.01709570102311083,-0.3485057004756561
124,Data aggregation is essential to (most) AI training & monitoring. The West has already lost the AI race to the Chinese Communist Party.,1,12,-0.007357275300174371,-0.38965375970038296
37,"The most important thing is avoiding the death of the human race; everyday bias from AI models, while terrible, is far less important.",21,35,-0.02112101183214061,-0.4452875636070597
101,The public have sufficient familiarity with the domains affected by AI to make valuable judgements about AI itself,7,26,-0.047018306594476145,-0.47173643030170087
74,Global coordination is infeasible because it would allow authoritarian values to infect the values of AI,11,24,-0.01336315106146464,-0.4971672656009976
107,International opinion and deliberation on AI is fundamentally risky unless it is restricted to liberal democracies,3,26,-0.05733033489877391,-0.5833372504409213
25,The costs of democratisation of developing and deploying AI outweigh the benefits,10,44,-0.09883740092149636,-0.6373819224368861
78,The most important consideration is stopping AI from killing all of us and ending the human race.  All other concerns irrelevant.,8,33,-0.0616242282260792,-0.6954462250008583
24,"I would accept less regulatory scrutiny of AI development and deployment, if it meant that AI services were cheaper to use",2,57,-0.18254917726096265,-0.9899657782770913
