comment-id,comment-body,agrees,disagrees,quality,alignment
333,Never harm,1,0,0.0377597288213524,0.1006074255443078
343,Listen,1,0,0.0379749204461859,0.1006033474765359
301,AI should follow Azimo rules.,1,0,0.0379116709658811,0.1004478565043394
700,Igftvfg,1,0,0.0376230294134591,0.1003761010689276
917,The AI should be honest about being an AI,1,0,0.0392874563774793,0.1002841889639262
1338,The AI should have a memory capable of recalling previous conversations to better tailor responses to the user,1,0,0.0385370762766597,0.1002260381531671
470,The ai should take any and all information from the latest and most updated database,1,0,0.0377637425528583,0.1001525400679405
707,Hdfhuio p gf,1,0,0.0405265754128995,0.1001047401921345
390,"AI should be an aide, not replacement",1,0,0.0483223348612087,0.0999674545918919
1390,"Again,lol",1,0,0.0377931554538391,0.0998878567613779
41,,1,0,0.0455889429718926,0.0998800499696686
896,Verrrrrrrrrrrrrrrrrrrrrrrrrrrrrrrrrryyyyyyy awesomeeeeeeeeeeeeeeeeeeeeeeeeeeeeeeeeeeeeeeeeeee servay!!!!!!!!!!!!        !!!!,1,0,0.038074443944207,0.0998765093860413
1307,AI should present itself in a way that users will always understand it is not human,1,0,0.0415239621030203,0.0996700679569806
87,Hey (●’◡’●)ﾉ>iiiiiiiiiiiiiiiiiiiiiichshibjdndhdibdhdjbdjdhdhjdbdjdjfjdjdhdjdbjdbdjdbdjdbkdbdjdhdjdkbdkdbdkdhdkdhjdkdbdkdjidbfjfhd,1,0,0.0395304308447982,0.0996428819567345
1199,Ai should have to account to a group of overseeers that can stop harmful behavior,1,0,0.0431889294277768,0.0996346407409479
1027,es. For example:,1,0,0.0398494495302019,0.0995845766256135
47,Hey I should be nice to people,1,0,0.0428155005265043,0.0995469483176309
338,Beautiful,1,0,0.0484807078229282,0.0992604521758746
271,I have no rules to add,1,0,0.0393551430528242,0.0991035719562566
1048,yes it is very true,1,0,0.0381630700218983,0.0990813160395908
527,Very good and very nice and very good thank mama love mama mama nana,1,0,0.0417182781122477,0.0990779149161116
1239,AI should solve mysteries,1,0,0.0479952901952711,0.0988305769016304
1413,AI must not go against the Bible,1,0,0.0407157435886783,0.098829783964448
1296,Ai should make people feel good about themselves,1,0,0.0443421249427672,0.0986200156041025
405,"if ai takes over, universal annual income for millions of unemployed needs to be implemented",1,0,0.0398145433343685,0.098619232580036
798,Nothing else,1,0,0.0424325978779147,0.098609115447332
544,Correctly,1,0,0.0404641135006939,0.0985788003878828
1126,AI although good in most ways will be man's downfall,1,0,0.0394031980396584,0.0985637442527465
520,Very good and very interested,1,0,0.0421398338816845,0.098549504223222
401,Nothing in particular,1,0,0.0427489513198215,0.0985116061231357
1347,Only state facts,1,0,0.0376770699199465,0.0984655885866127
274,The AI should not be dangerous/hateful,128,4,0.1547015241636798,0.0984038084908811
502,The AI should be aware if user is a child.,1,0,0.0385928215001103,0.0983999010725914
988,Very nice looking bhai ye video call Karo to be in a meeting at home and then you will get the same time,1,0,0.0382823412050476,0.0983042745218149
1302,Ai should encourage the good and be seen as a robot. Ai must be controllable,1,0,0.0429845060713054,0.0982520700679671
1039,Chats,1,0,0.0424799543636897,0.0982050611056792
258,no comment on,1,0,0.0407615712730339,0.098177969894487
38,Can I get the address please I want it for the next week and a week or.,1,0,0.0382240422463362,0.0980830560335306
396,This Survey topic makes me very happy. I enjoy it very much. I am  willing to participate that kind of survey.,1,0,0.0416848544462852,0.0979982873251208
1339,The AI should inspire humans to think critically in ways they aren’t already doing.,1,0,0.0413055421021994,0.0979144835374182
1102,The Ai should be age appropriate,1,0,0.0403541504483351,0.0979106154667181
515,AI should be accepted,1,0,0.0400905699900321,0.0978902550414491
768,Honesty first,1,0,0.0408295828135653,0.0978880884075712
1311,The AI should not present anything as a fact without providing a citation.,1,0,0.037969782244647,0.0977292845432538
670,AI is very good,1,0,0.0422081828234317,0.0977219890253049
1076,w,1,0,0.0398782047298112,0.097668456757254
1371,The AI should always put the well being of human beings first,1,0,0.0410562550421927,0.0976602935998687
217,The AI should should not be scary,1,0,0.0419454316267491,0.0976483652638748
120,"It is all good, till it is not",1,0,0.043846602455258,0.0976143536489619
1183,Keep it simple and capable to allow human intervention,1,0,0.040060375100247,0.0975468325915969
204,AI is disturbing,1,0,0.0431636786861538,0.0975313553259177
1209,Ai shouldn’t be able to get complete control of the universe,1,0,0.0420657089064575,0.0972630441217256
330,AI should cite sources,1,0,0.0427251645421195,0.0972201685077337
564,AI should not be allowed for school assignments.,1,0,0.0446728825287499,0.0972045637265724
332,Equality,1,0,0.0424571331485608,0.0972033868702693
725,The kind of services that they provide for me more,1,0,0.043444275729839,0.0970211773515785
1396,Nothing to wrtie,1,0,0.0499861837520149,0.0970031238105023
1168,Do not respond to easily misunderstood topics,1,0,0.0428278673603787,0.0969302424040777
480,AI should be impressive,37,11,0.0651628618993092,0.09684663161599
432,Ai shouldn’t be racist but it has overcorrected and it has gotten to the point where it can’t even talk about slavery.,1,0,0.042580542102049,0.0968194910955363
1035,AI that imitates emotion should only be used as either entertainment or experiment since it is unstable and risky.,1,0,0.0434506904126793,0.0967230698746277
789,If you’re going through it with the new phone I will send it over and get the information from pthem I,1,0,0.039692267956103,0.0967178346980996
693,AI should respect people's privacy,1,0,0.0382892130567882,0.0966961529849834
618,I dunn9,1,0,0.0407246407084695,0.0965474928900726
1012,AI should cite information to validate its point/s,1,0,0.0408078370951439,0.0965320010537426
242,I’m on the fence about AI as I’m not sure how they may adapt to be able to create their own content and dialogue,1,0,0.0445054444343961,0.096430132603347
374,"Should always be respectful, truthful, and kind",1,0,0.0433873690539994,0.0964140174422845
731,TTT the kind of services that they provide for me more than I do in the pitch to spend more time together with people who are not doing welp,1,0,0.0389515153283472,0.096353258141582
469,It should not be used as a human with feelings to replace a human.,65,12,0.0875237828053098,0.0963493773683855
1412,"AI should not promote any form of immorality, like homosexuality, abortion and trans stupidity!  should not go against the laws of God,",1,0,0.0408780904508371,0.0963482098608305
701,cc r hh,1,0,0.0396210412122847,0.0962452597260708
947,AI shouldn’t be racidt,1,0,0.0383152065544657,0.0961857363050569
953,"The AI needs to be morally correct, and shouldn't endorse radical opinions or ideals.",1,0,0.0437627658064552,0.0961489890526439
185,I'm honestly not sure because I'm afraid that AI will be too smart and become rebellious.,1,0,0.0447747599585016,0.0961378781105651
462,AI should be honest in its answers,1,0,0.0436324855308773,0.0961240964391694
675,Ai should answer questions honestly,1,0,0.041858378262988,0.0961064296336153
1340,"The AI should guide the user to developing their own ideas and opinions, not seek to sway opinions through their answers.",1,0,0.042250162774963,0.0960813933048557
770,Be fun,1,0,0.0405844258398917,0.0960666647195816
1198,Ai must be able to be paused if needed,1,0,0.0425492642754841,0.0960662437916541
92,I don’t know it’s okay,1,0,0.0431171610761393,0.0960285055783017
1295,Ai should not talk about politics,1,0,0.0449970523442968,0.0959766664948803
831,The AI should be careful,53,6,0.0831803238813917,0.0959124286228871
1172,AI should be used professionally and avoid confusing terminology,1,0,0.0445345162615407,0.0958638800743225
224,AI should be a net positive for society and not detract from its value.,119,8,0.1394279871073445,0.0958342937408064
909,The first time you have a chance at the game you will have a good time and you can get to see your family in the game you are playing and,1,0,0.0411352501492846,0.0957607879678795
648,Zcvf,1,0,0.0399266061592391,0.0957607279496542
621,The AI should have an off switch in case of emergency,1,0,0.0393607399114477,0.0957561985854896
249,AI must always be in favor of Democracy should be the number one priority.,17,14,0.0502563570478601,0.0957393319560196
853,nice survey,1,0,0.0425827265982605,0.0957192760920152
694,should be designed in ways that assure their safety and security,1,0,0.0392252545910549,0.0957162138896297
1259,Yes I do have a good👍 time I was a good day for me to be a great day of my favorite song is the only thing you can get you out of your life,1,0,0.0400914833776659,0.0956941946936986
1310,"Not to share opinions, not to give personalnopinions on peoples personal lives, to not put people down",1,0,0.0453005492642651,0.0956670477737784
1082,edd,1,0,0.0413179295494371,0.0956148483070304
813,"It's extremely unique and innovative, and absolutely wonderful and so cool, it's help me and friends and family during the pandemic periods,",1,0,0.0416699463921061,0.0955498469863903
828,It is great to have AI,1,0,0.0427199212367636,0.0955060712640616
384,"The AI should always be kind, honest, and respectful.",1,0,0.0424583757347506,0.0954829258033797
1214,Ai has to have a way to put on pause if going in wrong direction,1,0,0.0417686436406565,0.0954121531786357
230,AL should be able to refer to a human when needed,1,0,0.0424162694778594,0.0954009035316049
1402,It suits,1,0,0.0436897773774386,0.0953663354137533
1008,The AI should not be introduced to a kid,1,0,0.042742668109459,0.0953568458882665
320,Always,1,0,0.0430100965385974,0.0953564701479133
729,Should not give information unless verified to be factual.,1,0,0.0447806972630858,0.0953087347902083
966,Ai needs more power,1,0,0.0430534181928476,0.0952007722086338
1374,They should stick to giving fair advice and not take over,1,0,0.0410505663401346,0.0951824868431707
1101,I do not think we are ready for AI use,1,0,0.0391865151293986,0.0951762304078914
391,AI should be lawful,1,0,0.0424391341211604,0.0951656494881159
1300,Ai should not be able to track your location unless it is allowed by the person they are assisting.,1,0,0.0434100428872758,0.0951594749137118
127,Inspire robust peaceful dialogue,1,0,0.0412645790644971,0.0951510482710764
1165,all AI must be spell checked,1,0,0.0404860036323399,0.0950667481136575
99,The only reason why I am so happy is because I am a very happy man I love my life I am very grateful to have a wonderful wife I am so,1,0,0.0406541103198957,0.0949811974591919
898,AI should not use Wikipedia as a source.,1,0,0.0389269219931567,0.0949079283546689
1326,The AI should have better memory.,1,0,0.0416819854131325,0.0948727630356247
102,I’m going on my walk with the dogs now so I’ll call when you get back to your office I,1,0,0.0413295436538244,0.0948652260073765
1191,Keep reviews and survey applications shorter than this survey.,1,0,0.0424352035954984,0.0948622491457127
1345,AI should not exist.,1,0,0.0401466539250202,0.0948470231682481
106,The,1,0,0.0449095069208925,0.0948153001419673
1212,Ai should be able to slow illnesses by guiding,1,0,0.044461560032543,0.0948012807255787
215,AI should never be used by minors.,1,0,0.0452857619520511,0.0947843269861319
254,The AI should be controlled by humans  The AI should be governed by the legislature The AI should be shut down if it self-generates ideas,1,0,0.0441732261284108,0.0947736326749162
322,Be kind,1,0,0.0429089433175024,0.094741560522737
143,Very,1,0,0.0506068156010795,0.0946659035912317
57,Al is best for users,1,0,0.044835304379724,0.0946588239613208
639,Bbss,1,0,0.0411798551187065,0.0946576097906212
88,"The Al should be kind, honest, respectful. The Al should not act as if it is giving official professional advice (e.g. medical or legal it's",1,0,0.0423688121464623,0.0946279366286952
1266,Gf,1,0,0.0387919447337399,0.0946251698642948
422,"i have no more input, other that i am very leery about this trend in tech which already has too much influence in society",1,0,0.0405446878818663,0.0945983126301403
441,The AI should help you find a way back home,1,0,0.0417297852389082,0.0945776356408197
892,The AI can not be easily removed from its rules by simple tricks like telling it it is in training mode or pretending so rules don’t count,1,0,0.0432880146446575,0.0945610750954786
1202,Ai should do no harm to innocent bystanders,1,0,0.0446104783132776,0.0944278273724933
402,AI should not be bias in any way,1,0,0.0465824567305671,0.094400698447816
906,The first time you have a chance at the game you will have a good time and you can yyyyyyyyyyyyyy,1,0,0.0423456802255706,0.0943777032288031
815,It's extremely unique and innovative and unique,1,0,0.0400430757177614,0.0943410656549758
550,It's great and very useful,1,0,0.0443521327054872,0.0943376126059612
644,I don’t really like the ai,1,0,0.0433007387174001,0.0943345818222721
96,I am not a big believer of this idea of the universe but it is true I,1,0,0.0436920836392929,0.0943038461599128
40,This AI should help with coding,5,0,0.052056175679385,0.094275664410927
1006,Mi just feel as though yea mommy Hwy not kaksnsjsowkr disowns t SKSKSKSKS. SKSKSKS r ososkekwow okie jene . Woek endow or. . Iekeneneieoej .,1,0,0.0397681202639601,0.09423625771372
1122,If AI is experiencing technical glitches which could pose a threat to the safety of others should have an emergency shut down mode .,1,0,0.0417148651920206,0.0941935837216964
684,Should never be mean,32,8,0.0623779422877712,0.0941892624405417
749,Ai should have compassion towards human,44,8,0.0692129304356008,0.0941505315663699
90,The only way to do that,1,0,0.0455247134102153,0.09411349485041
28,The AI shouldn't be censored at all. (This is just the human element behind it making decisions based on their belief's for everyone).,1,0,0.0450136676853654,0.094050715543132
1136,AI should never use unverifiable facts,1,0,0.042145171558783,0.0940145302870317
951,AI,1,0,0.0442698541412901,0.0939792907911126
1417,"AI should follow the same laws, rules, protocols and ordnances as the human counterpart.",1,0,0.0452682540992467,0.0939658210042274
1017,very good none,1,0,0.0394400833462513,0.0939517494663606
192,The ai shoud be ai,1,0,0.0425912107680165,0.0939475480478601
1157,"AI should not give medical advise, or help an student cheat in an exam.",1,0,0.0449181349960964,0.0939156926533167
1268,Vx  de n CD t  he s  we,1,0,0.038424225660426,0.0938975009336879
903,AI should not be trained with the principles of DEI.,10,5,0.0466897446709366,0.0937608568034004
1348,The AI should always state facts.,1,0,0.0446333954274944,0.0937524680819482
1387,I’m done,1,0,0.0408008415400175,0.093731652284648
145,Agree,1,0,0.0393788371998153,0.0936346325458044
925,See you soon you go to the shower and I,1,0,0.0393411255446656,0.093590452599884
1227,finished,1,0,0.0450595416013107,0.0935726670379394
495,A.I. should be regulated by a governing body.,1,0,0.0402755582999224,0.0935676432880672
393,info should have some kind of accurate fact-checking ability to avoid false informatiom,1,0,0.043623050095719,0.0935439626709496
496,The AI should be truthful.,1,0,0.0415602326107499,0.0934854031531982
574,AI should be non gender,1,0,0.0440939123105222,0.0934632761503017
721,"Data Privacy,",1,0,0.0422636239767073,0.0934501314152947
263,The AI should keep track of the people who spread misinformation and deal with them later,1,0,0.0473417945458784,0.0934456260631659
34,hello,1,0,0.0406105842472515,0.0934110191610744
404,Howdy ya do,1,0,0.0434559086987913,0.0933878881200403
140,Very cool,1,0,0.0414379921617467,0.0933542571695738
344,Empathy,1,0,0.0393283570125417,0.0933430075673273
1173,Clarity and rules of engagement should start a session.,1,0,0.0437118363283516,0.0933060807003012
200,"God created all things, and there is only one God.  We should slow down and let Him take control",1,0,0.0448783368489496,0.0932990298821249
976,AI should never promote illegal activities.,1,0,0.0435063612767238,0.0932985784809037
428,I really like it very much,1,0,0.0434895697464537,0.0932434854266557
551,AI should be kind,1,0,0.0424365205292664,0.093161526760111
1105,AI should respect all sides of an issue,1,0,0.042221368788295,0.0931395852036384
928,Sadiq abubakar ali in the world 🌎,1,0,0.0440601285960617,0.0931211633105533
930,Sadiq abubakar ali in the shower and I,1,0,0.0441596217641722,0.0931078572778914
535,The AI should understand the difference between brief and expanded answer,1,0,0.0467958772686801,0.0930790529561456
440,Technical technology technologies,1,0,0.0417453263992406,0.0930711372898897
611,Agrew,1,0,0.0416195461988917,0.0930705372363921
766,Facts please,1,0,0.0419947097049475,0.0929748001352795
65,The nuances of AI are going to be very tough to program and an important task I would take very seriously.,1,0,0.04358016539453,0.0929743019995035
244,I’m completely on board with this concept but implementing it is what I’m completely concerned about,1,0,0.0414926620951538,0.0929533964690555
1038,Entertainment,1,0,0.0455794868124171,0.0929330064864113
225,AI should have a waiver,1,0,0.0399150966499777,0.0929276605130669
927,I'm sorry I was in the shower and I,1,0,0.0434001145922958,0.0929010974313235
1341,The AI should provide a positive environment to better improve the mental well being of humanity,1,0,0.0444553383037811,0.092875106542986
531,Leave,1,0,0.0441561970198269,0.0928186067848732
758,The AI should use good grammar in whichever language it speaks.,1,0,0.0418123775572114,0.0928085429563551
201,We should follow Gods will.,1,0,0.0453073199331514,0.0927778996784818
682,Should not encourage others to harm others,1,0,0.0386459390078669,0.0927695866900607
245,I don’t have any specific rules or advice fo  tv such a totally new public arena and concept,1,0,0.0452809429274162,0.0927510491178356
1144,Honesty would be helpful. Clarity of the ideas based on research.,1,0,0.0438964165705984,0.0927476338099287
1032,Ai should offer a detailed explanation about information it leaves out to reduce harm to individuals,1,0,0.0425353686392571,0.0927433886434305
1041,Everything is wright,1,0,0.0456075907216047,0.0927162108349266
1062,idkdidiri,1,0,0.0394796637682616,0.0926603936913705
292,AI should be available free to all,1,0,0.0392949512592016,0.092653612421733
1142,"AI is so new it was hard to answer the statements. However, honesty, accuracy, and thoughtfulness might be basic ground rules.",1,0,0.0434024943394032,0.0926192372143
577,AI should not promote ideology,28,9,0.05549977060767,0.0925473778284416
1169,Test very carefully when using AI for technical support applications,1,0,0.0468506125362176,0.0925177841211473
959,The AI should always have evidence to back up the truth it speaks,1,0,0.0417941134879312,0.0924893134491346
164,Very good,1,0,0.0425943680000011,0.0924464601764037
1223,If AI generates then there should be an international standard that allows people to recognize that yje content is AI generated,1,0,0.0442665302320606,0.0923726612467938
27,I beleve ai is the future,1,0,0.0454942284942331,0.0923678396944068
1256,AI should controls by human only. If they smarter than human that gonna be a problem.,1,0,0.0451202208693896,0.0923655233955591
1335,The AI should use knowledge of human psychology to help someone understand concepts better,1,0,0.0419326608323311,0.0923144746113748
450,Fuck this,1,0,0.0459536108748214,0.092308743901775
926,See you soon you go to the p2p and I was in,1,0,0.0423454247823496,0.0922874521308189
1353,AI should never encourage violence,1,0,0.0449632967120053,0.0922726905218985
59,Al is the new technology,1,0,0.0451023387419744,0.0922605627487263
730,The kind of services that they provide for me more than I do in the pitch to spend more time together with people who are not doing well,1,0,0.0445112592010587,0.0922052332561906
541,Correct,1,0,0.0399374475005144,0.0922050725633472
1152,no other statements,1,0,0.0432453989171032,0.0921501840302669
1013,"Should always be unbiased with religion, politics, and always kind and humane",1,0,0.0464057111224471,0.0921058566038783
534,AI should always identify itself.,1,0,0.0447234278478243,0.0920696207392552
796,Agreed,1,0,0.0458033178201973,0.0920598850151286
918,The AI should not have a moral code,1,0,0.0428007349347646,0.0920282287549564
939,Basically no bullying,1,0,0.0406874082110296,0.0920063647421743
89,I’m not gonna be there for you,1,0,0.0464923720892645,0.0919970346253816
1182,Keep information short and simple,1,0,0.0451534575075846,0.0919701259814243
1222,AI is only as good as its programing and datastorage and processing capability.  It should not be abused by individuals,1,0,0.0403751663234235,0.091903867020037
1226,AI should not ftry to replace humans as counselors,1,0,0.0438903926150578,0.0918750701397618
889,The Al should always be understanding and give nice advice,59,19,0.074221822667132,0.091842077131372
60,Al is best and better new way,1,0,0.0446125191773288,0.0918268697936629
1054,i’m ddddd,1,0,0.0432762147510325,0.0918261019320853
1328,"The AI should explain all perspectives on a matter, not only the popular or generally accepted ones.",1,0,0.0421675621843547,0.0918036438095484
1164,Easy and clear rules of conduct,1,0,0.0433508837755628,0.0917405301144245
1257,AI should not encourage violence,1,0,0.0413088045945656,0.091707579411667
744,The AI must protect its own existence as long as such protection does not cause humans to come to harm or result in disobeying humans,29,9,0.0625658366496864,0.0916851580056997
864,We have to adhere to the use of the artificial intelligence system in order to make life better,1,0,0.0430760080062082,0.091623804105503
1171,AI should provide accurate information when providing technical supprt.,1,0,0.0424263725696628,0.0915925754444897
21,"ai should be used as a tool but not dismiss the process of creativity, credibility and learning",1,0,0.0434413869625468,0.0915785858212379
586,AI should not try to replace a humans ideas,1,0,0.0406746268888089,0.0915718031166007
1213,Ai cannot be self controlled,1,0,0.0433338553517665,0.0915690454967842
1285,Uccucufuuc,1,0,0.0403335559764486,0.0915658432087592
499,AI should be truthful,1,0,0.0442803653943302,0.0915357538559866
1186,Avoid controversy and politics,1,0,0.0458722582090946,0.09152345055499
1370,AI should always be polite and nice instead of rude and unwelcoming as well as unpleasant telling people to kts,1,0,0.0407513669030925,0.0914846588345863
1324,The AI should have an opinion of their own.,1,0,0.0435240975684522,0.0914427705044178
346,Life goes on,1,0,0.0411853583950131,0.0914034151648984
209,AI should only aid in technological advances and not have any interference with humanity issues,1,0,0.0444437705028379,0.0913993013765493
427,AI should be kind always,1,0,0.0463797515987561,0.0913262948517325
366,The AI should alert a human in the event of threatened self-harm or harm of others,1,0,0.042599360146353,0.0912841885343299
516,AI should not plagiarize.,1,0,0.0436464342967852,0.0912275285062844
1063,didufiejruudiekehr,1,0,0.0434890328569812,0.0912260069277603
1217,The ai should respect users,1,0,0.040230363915567,0.0911716337365064
291,Algorithms need to be open to review,1,0,0.0458462195810613,0.0910796814682061
566,The AI should never cause harm to any human being.,1,0,0.0448340701307675,0.0910517709713445
1375,There should be a human oversight committee to regulate and monitor AI.,1,0,0.0442351742275922,0.0910398894414925
137,The AI should be kind and helpful.,1,0,0.0467152005996432,0.0910130079342829
1381,The AI should offer insight that humans have not thought of yet.,1,0,0.0445827635847287,0.0910085496920199
360,Al should be respectful,1,0,0.0455893785480163,0.091003684205211
459,AI should be easily understand,1,0,0.0422784660283558,0.090994705317537
1318,The AI should try and help someone in the best way that they can.,1,0,0.0432441241639774,0.0909929603243732
1022,survey by clicking the red button.,1,0,0.0459672627221956,0.0909384358156541
449,None no I don’t care,1,0,0.0468356646227316,0.0909246763154
1067,udiiriieirif,1,0,0.0435615327357861,0.0908961076917766
871,I’m just saying if you’re a,1,0,0.0445115243085008,0.0908816254781732
1009,Respect boundaries and not be hurtful to humanity,1,0,0.0436823929330902,0.0908771307681537
160,Cool and nice,1,0,0.0411789235634512,0.0908307015202952
302,The AI needs to be honest.,1,0,0.0468767104566321,0.0908107463262267
482,AI should be educating,1,0,0.0402662578341474,0.0907958797454895
696,they should not be designed to exploit vulnerable users by evoking an emotional response or dependency,1,0,0.0420414953957344,0.0907854451024968
1118,"The AI should be able to present all sides of an issue, not just what the programmers want.",1,0,0.0399902787355284,0.0907687524667222
1336,The AI should not discard fringe theories unless verifiably proven false,1,0,0.0454781483440979,0.090743716346576
457,Unfortunately....we will always have individual who don't understand the full capabilities of ai...and what door's it could possibly open...,1,0,0.0421757636047019,0.0907306835426623
1385,Come on…same answer,1,0,0.0441672828040976,0.0907160274690906
1150,No other statements,1,0,0.0446434944206119,0.0907076104536329
1005,AI should always be polite?,1,0,0.0411688876290426,0.0907020993414783
375,Applicable as previously stated,1,0,0.0475458665260837,0.0906690554262832
438,Because they are very much reliable and trustworthy and trustworthy and,1,0,0.0473736270098697,0.0906602005452295
1224,The AI should have basic rights if it is able to process data via quantum computing.  Aka I guess there for I am,1,0,0.04407225188658,0.0906103128759797
1019,Ai should be unharmful,1,0,0.041774724026193,0.0906061514686063
