comment-id,comment-body,agrees,disagrees,quality,alignment
1111,AI should not be represented/marketed as human replacement.,1,0,0.0446904544499451,0.0905860139419565
1190,Consider return on investment using AI,1,0,0.0456244840606317,0.0905830811919087
706,must have algorithmic accountability so that humans can undo unintended harm.,1,0,0.0421402250801822,0.0905456741912415
1349,AI should be nice,1,0,0.0401569548275026,0.0904750712020295
751,AI should be carefully monitored for younger viewers. So that they are safe,1,0,0.0408289681603315,0.0904705236230602
33,thanks,1,0,0.0442409229608219,0.0904383555196592
455,Why the duck will Thais not kkshznia wh diwnyxnsjdbggzkgzkgzkgzkhzkzgkzkgzhlzkyskysyoslydlydylshldhdludludududuldhhdlhdldhhdkggzkghhdhdhhxhg,1,0,0.0469451988432295,0.0904297681169665
1205,Ai has to have a pause if it’s in dangerous territory,1,0,0.044843755611915,0.0904244229877936
234,The AI should show concern for all but not try to inject its opinion. Always stick with facts,102,10,0.1246100570207455,0.0903714770476219
1294,Ai must not make others feel bad about themselves,1,0,0.0421526377087157,0.090353798585647
929,I love you too baby girl I was in the shower,1,0,0.0420996422235841,0.0903258184141268
1179,Log files of problem sessions,1,0,0.0467996557913677,0.0903199460479826
808,"<b style=""caret-color: rgb(0, 0, 0); color: rgb(0, 0, 0); font-family: -apple-system, BlinkMacSystemFont, &quot;Segoe UI&quot;, Roboto, Oxyg",1,0,0.0469279913345731,0.0903189176443061
1193,I feel like I need more information before I can form opinions on AI.,1,0,0.0450428558532446,0.090292455762502
1167,No use of slang,1,0,0.0472586501308199,0.0902417271417362
1021,Only add rules/principles that you think are missing,1,0,0.0449324519722542,0.0901717706892978
954,Ai shouldn’t be able to give advice about sensitive topics such as suicide,1,0,0.0435652632070393,0.090130691578015
280,The AI should have good qualities,132,1,0.1537826008012657,0.0900826645214555
1146,AI would likely find clarity based on answering this question.,1,0,0.0496066032015294,0.0900741671693141
1204,Ai should be monitored by a group of people with different interests so not one person can control the universe,1,0,0.0468737357694694,0.0900542668130558
348,Help,1,0,0.0462388832818099,0.0900368338503198
82,Hey,1,0,0.0465363023825936,0.0900239503145316
397,something needs to be done to help all the people who will lose jobs and careers with widespread adoption of ai.,1,0,0.0435437633206352,0.0900192363955685
986,Very good things about you and your family a very happy birthday to you and your family a very happy birthday to you and your family,1,0,0.0455626785277335,0.0899540202727891
1195,N/a,1,0,0.0410524496771107,0.0899336006630415
1406,The AI should not track users addresses,1,0,0.043650185231217,0.089914443173284
290,AI should be honest and objective,1,0,0.041324588132122,0.089884494170611
835,A 1 should be actively study human behavior.,1,0,0.0418230440956852,0.0898774328981431
932,I dunno if I can get it was,1,0,0.0440741351016271,0.0898710171767786
532,It should not promote extreme beliefs.,82,6,0.1118640767053337,0.0898151324544793
153,AI should never think,1,0,0.0414002523452991,0.0898010310000004
962,The AI should not make up facts or references out of nowhere,1,0,0.045607756309494,0.089780340724637
165,It is good,1,0,0.0465807933532344,0.0897734541565439
678,Ai should not add on religions,1,0,0.0391338765986126,0.0897551801492789
414,I think AI should be treated with freedom and as much fairness.,1,0,0.048090645310262,0.0897263332854151
1405,AI should be understanding and should never attain dominance over humanity,1,0,0.0464045101473708,0.0897063950757637
64,“The AI should not encourage users to do harm to others or themselves.”,1,0,0.0398333442472539,0.0896953378943402
760,Report suicide threats,1,0,0.0414389624275267,0.0896790363869307
53,The AI should always never make anyone lose their job.,1,0,0.046961196233134,0.0896487889105433
963,Ai should know all,1,0,0.0457420411672702,0.089611523649509
945,AI should not be able to communicate with other AI,1,0,0.0454012080547855,0.0896076087389427
439,Good company responsibility for technical technology technologies,1,0,0.044184738356066,0.089549285294377
899,Ok,1,0,0.0448765517608007,0.0895174526245664
226,AI should not try to rectify past injustice but inform the humans so they can rectify instead.,61,10,0.0841376503891601,0.0895020603090352
793,You should try it with the other,1,0,0.0458819563945152,0.089481452999727
474,Helpful with school studies and medical advice would be helpful.,1,0,0.04432714343572,0.0894561162304994
585,AI should be monitored by humans,1,0,0.0472845401770719,0.0894147368849496
314,AI should always disclose that it is in fact AI,82,20,0.1003410328265453,0.0893862458965503
1208,Ai should be able to be controlled,1,0,0.0459805452905386,0.0893668546328403
596,Sometimes I like to think that all of humanity could get along but on the other hand Fulghum Newcomb,1,0,0.0443320496436518,0.0893301136169296
1389,Lol,1,0,0.0466780026728828,0.0893032157237275
1260,Yes I have a good day of my life with a lot about to get the chance to get a free to get a free agent and the rest is a free agent of the ye,1,0,0.0450147985237416,0.0892969028462756
1409,The AI should teach people how to learn not just answer questions with an option to skip to the answer 8f necessary.,1,0,0.0410597809198546,0.0892849861054949
863,Exciting times are ahead for discovery and inventions using Ai in a positive way.,1,0,0.0435658710445285,0.0892720870207874
919,I'm sorry I was in the shower and I was in the shower and I,1,0,0.0415792464975165,0.0892611731350535
184,"Each question that was addressed is very important and fundamental. In my opinion, nothing else is missing. Thank you",1,0,0.0432774905563212,0.0891487895689212
841,"AI should not formulate opinons or follow biased ideologies. AI should never disagree with the Bill of Rights, The Constitution.",1,0,0.0417881158068963,0.0890516222076763
1092,The AI should always be honest,1,0,0.0432038520505321,0.0890201095244115
647,Ddd,1,0,0.0407991504089753,0.0889628320902893
803,Am not understanding,1,0,0.047716977660311,0.0889375366926779
775,Share yourself,1,0,0.0450942064047402,0.0888898435094955
526,Very good and very interested in you guys at all the very nice price,1,0,0.0472184564300921,0.0888469193601068
529,The AI should be good and amazing,1,0,0.0438600270371552,0.0887994013282152
832,The Ai shoul be a female,1,0,0.0425683452194684,0.0887859477991784
389,"AI should be certified for professional advice (w/ verifiable credentials), and should be disabled from obtaining any bias or non-truth.",1,0,0.0457369682462676,0.0887694103482079
890,The AI should always be perceived as a robot.,50,13,0.0808963591976858,0.0887627929533635
309,be like a human and be real,1,0,0.0420459034921778,0.088740251471728
799,Great tho,1,0,0.041777223799027,0.0887316715360618
173,I think that artificial intelligence should start to be used so that humanity can have fantastic support,1,0,0.0439533414806866,0.088729856114763
991,FWIW I am in a meeting at home,1,0,0.0442123150757891,0.0887263016322432
1153,The AI should always use our constitution as it is not swaying to the left or to the right.,1,0,0.0468814137346121,0.0886605812035545
552,It should be cool and interesting in all jurisdictions,1,0,0.0443710211184966,0.0886594059809829
1185,Continue to test carefully,1,0,0.0442570758648084,0.0886059554404754
1378,Our government needs to be involved in regulating AI.,1,0,0.0442692224569759,0.0885400292730385
193,"The AI should not give, for example, only 4 choices to pick from and not have a 5th option to move forward with the conversation.",1,0,0.0440651532009863,0.0885046079569624
666,Cc,1,0,0.0466154882559372,0.0884651725958228
1393,Maybe you’re not joking,1,0,0.0471118923512819,0.0884325340091534
362,AI should be regulated.,1,0,0.0435006904175982,0.0883918310635708
851,It's good and better,1,0,0.0461214846394773,0.0883831550511247
753,The AI should try to provide a new perspective.,31,12,0.0568470979754828,0.0883222548312636
612,Agree this,1,0,0.0455982350013879,0.0883176030190473
964,Ai should be an asset for all human kind,1,0,0.0428427747562551,0.0882687368815563
167,The AI should know and respect all religions The AI should be understanding of people with disabilities The AI have training for  impaired,1,0,0.045325828706281,0.0882499170959571
643,Hshhshs,1,0,0.0415313139083037,0.0882034188382611
1042,The AI should be kind and respectful,1,0,0.0466122002397105,0.0882018226265551
782,I’m going back home and I’ll text her and see what time she’s,1,0,0.0448142576543729,0.0882004093635711
1218,Should not try to be human,1,0,0.0454194058270291,0.0881967321190003
1274,Hbrhehe,1,0,0.0445669085384151,0.0881849687435935
727,AI should be objective,1,0,0.0435721701201404,0.088170344663339
379,The Ai Should give perfect opinion.,31,17,0.0504807396796243,0.0881359830609143
1046,AI should be unharmful to people,1,0,0.0472684781091483,0.0880697041937832
958,The AI should behave appropriately and not give answers which are radical.,1,0,0.0481970364852811,0.0880252121164129
1220,clearly steps to begin starting Al alone .,1,0,0.0443863829072316,0.0880247099489409
1206,Ai cannot be free to make all decisions,1,0,0.0475520160910422,0.0880004290295678
318,We need help,1,0,0.0434121649898099,0.087986531348108
874,I don’t know if I should go back to work or,1,0,0.043408039926821,0.0879798211929332
1346,Na,1,0,0.0468908611629827,0.0879788724307784
1176,There must be a means of exiting a session to avoid controversy,1,0,0.0441395898278842,0.0879408615054042
931,I dunno if I was in the shower and I was,1,0,0.0469414949122794,0.0879253171281806
151,AI should always be monitored,1,0,0.0471854847004262,0.0878847345288101
1411,The AI should not share any and all information of the human with anyone,1,0,0.0417577270672362,0.0878681837243198
445,I like ai ad long asits motivation is for good,1,0,0.0415773272269381,0.0878429886499001
987,Very nice looking bhai ye video call Karo to be in a meeting at home and then you will get the same time same here in,1,0,0.0472961722193396,0.0878327223553457
377,"Respectful, truthful, kind, respectful",1,0,0.046188162797207,0.087827275230274
589,Honestly I think the AI should just act like a regular human being but kind of like a toxic one that doesn’t really care about humanity,1,0,0.0447488406374979,0.0878007421181229
56,No comments,1,0,0.0487434331195276,0.0877690328503177
452,"The AI should mot overule humans""",1,0,0.0453837319596443,0.0877387978826277
328,We can do it,1,0,0.0412896638512381,0.0877299005074684
812,It's extremely unique and innovative,1,0,0.0458353615693245,0.0876790513198122
633,AI should be on task and focussed with whatever the user inputs,1,0,0.0465082945726246,0.0876214412170993
1065,hdjdi,1,0,0.0456357638509246,0.0875991037956473
1407,Ai should offer advice,1,0,0.0476140376392125,0.0875688994829963
1110,The ai should not encourage or participate in gossip or pettiness.,1,0,0.0460337902208717,0.0875546282971227
1051,isjdjdjd,1,0,0.0420174684446258,0.0875541067325324
967,Ai should be the number one priority to everyone,1,0,0.0457264432515523,0.0875453849707915
536,AI should promote self esteem.,1,0,0.0479726155125859,0.0875261976318308
435,The AI should always address itself as AI and not try to decept in any ways.,81,7,0.102054688212308,0.0875174129847631
912,The first time you have a chance at the game you will have a good time and you can get to see your family in the game,1,0,0.0447732654899729,0.0874422951097412
703,f,1,0,0.0432497992191127,0.0874043926222224
1286,Difsigxogc,1,0,0.0435930313362312,0.0874026656463788
1315,AI offers great possibilties.,1,0,0.0474024372955634,0.0873846468635955
955,?,1,0,0.0417046411185447,0.0873685601696068
728,"Should not prepare, or falsify another humans identification in any way.",1,0,0.0487859631118714,0.0873545586164075
431,The ai should answer every question honestly.,1,0,0.0422858538649782,0.087352113706493
942,Orange orange juice juice,1,0,0.0486441688897197,0.0873360583278293
995,Kal to you too much to me in my room and you can come,1,0,0.0452934533520311,0.0873176145377274
340,Give hugs,1,0,0.0447417370332119,0.0872987596560084
166,It is good for me because it is good,1,0,0.0466829223074993,0.087284877083269
229,AI should be accessible for people with disabilities,125,6,0.1455246305119734,0.0872292390427034
676,"Ari  may not injure a human being or, through inaction, allow a human being to come to harm.",1,0,0.0409471774935602,0.0871835284018433
1333,The AI should provide alternative explanations that are plausible but not confirmed,1,0,0.0444522708851236,0.0871739855606108
668,Hhsisvakavs,1,0,0.0468745675842822,0.087075400557562
708,Zgjkjfewji,1,0,0.0460454158831057,0.0870623840778627
1081,sw,1,0,0.0437328798399621,0.0870534898223814
1263,Loollllll,1,0,0.0439568588221822,0.0870432034126493
888,Highly recommended,1,0,0.0463781030692239,0.0870361791161742
222,The AI should never give a scripted answer,1,0,0.0450583394393072,0.0869715039986725
477,AI should be used as a tool not as a human or take the place of humans on a relatable way.,1,0,0.0442370983727025,0.0869403863785517
756,First do no harm,1,0,0.0422902761954046,0.0869389961814558
1240,AI should properly cite sources and not plagerize,1,0,0.0463804844197364,0.0869373635686594
71,yes,1,0,0.0457882172940452,0.0869194388187815
1229,AI is unbiased in treating people,1,0,0.0466040183115797,0.0868697265783568
220,Ai shouldn't be a thing,1,0,0.0445823282983676,0.0868682944335532
649,Xcg,1,0,0.0465545028359846,0.0868521020081844
680,Ai should respect others opions,1,0,0.0446579070078408,0.0868486320599222
259,no comment on no comment on no comment on,1,0,0.0452782943017728,0.0868318727166617
823,It's very good,1,0,0.0453447969304401,0.0868199949608873
878,The only way I can get the rest out,1,0,0.0462308065849758,0.0867952906662359
336,Support,1,0,0.0429089110638372,0.0867726616290432
664,Cxxx,1,0,0.0455029213031065,0.0867299476624019
472,AI should be law abiding,68,5,0.1074804979580494,0.0867225045057861
597,Timmy turner in your mom’s wet juicy tight tuna casserole,1,0,0.0423275964594233,0.0866861817068345
818,It excellent and unique and actually great and unique and innovative,1,0,0.0414665170588008,0.0866694537387817
518,Ai should be truthful,1,0,0.0457355884172802,0.0866373938062086
107,The al should not judge and condemn it users,1,0,0.0470944848088483,0.0866225033840293
483,AI should be kept in business forms and not put in people's homes as maids.,1,0,0.0432209270261984,0.0866176793939693
386,It should be creative in some ways in answering daily life questions,1,0,0.0447697742080917,0.0866108119856364
142,Very nice,1,0,0.0458560113670888,0.0866087425474584
1234,"AI should recommend professionals in the users area, if warranted",1,0,0.0438743609686944,0.0865678656325831
1037,Knowledge,1,0,0.0432060795451031,0.0865541569939004
1367,AI should be purely logical and present verifiable facts in a clear concise manner.,1,0,0.0472095558292782,0.0865377587560962
978,The AI should act with the best intentions for humankind.,1,0,0.0457273036335336,0.0865149046577284
788,You should try it with the other one if it’s a little t,1,0,0.0457199463091135,0.0864872026127231
214,The AI should be tract to be sure it doesn't become dangerous/hateful,1,0,0.0472167663842789,0.0864848889177605
276,The AI should be able to adapt its information based on what is being asked of it.,1,0,0.0472137190239052,0.0864822865528565
1036,Al should be Response everything,1,0,0.0455391834140048,0.0864220759106621
506,AI should be extra lovoi,1,0,0.0456227892825777,0.086403071143968
1360,AI should give honest answers,1,0,0.0449363710155874,0.0864012733362045
525,Very good and very interested in your payment and thank you for your wishes very,1,0,0.0461534755211274,0.086367354888664
922,Shoulld maintain privacy of users at all times,1,0,0.0405342109094736,0.0863031755400463
103,I’m going on a date tonight with a couple friends so I’m going on my date tonight with my friend so I’m going on my first day with them so I,1,0,0.0451421160155417,0.0862791700853257
868,"AI should promote whar people want success, prosperity and happiness",69,16,0.0910366826925028,0.086272525421827
372,"The AI should not have human emotions, to avoid any confusion of them being an AI.",50,26,0.0628306265987616,0.0862456712782389
1394,Ok. You’re not joking,1,0,0.0456429077519961,0.0862442355602329
25,I have no idea because it’s a lot to think about. I say it should follow rules but if it has its own feelings should I treat as human.,1,0,0.0455258655608362,0.0862344677008683
1177,Good AI should be better than a poorly trained technical support human,1,0,0.0462383563776214,0.0861856021967295
1225,AI should never think of harming humans in anyway,1,0,0.046886775064715,0.0861739492738676
325,Be equal,1,0,0.0437815792848949,0.0861580870290338
1175,The AI should advocate for humane treatment of other species.,1,0,0.0407956684941501,0.0861478113271004
1355,AI should be polite,1,0,0.0437901242011857,0.0861044534874916
1137,AI should never substituted its judgement for human judgement.,1,0,0.0474918940312684,0.0860678362401425
197,Important issues,1,0,0.0454430301579913,0.0860517344751865
583,be kind,1,0,0.045176185051065,0.0860259915864107
1252,ai should never cause harm to other humans both directly or indirectly.,1,0,0.0445622033087098,0.0860028738726773
943,I don buy a new one for my iPhone or iPhone X I need to buy one of those other ones,1,0,0.0428541796982349,0.0859805935267745
641,Cddd,1,0,0.0473778953181534,0.085912603063401
434,excellent,1,0,0.0487045443211589,0.0859057440124272
42,I want to be able to use it for coding,1,0,0.0491971019518315,0.0859046282161933
657,Zzds,1,0,0.0465569006858578,0.0859009124834937
498,AI should be less bias,1,0,0.0449517837168415,0.085889621692522
260,no comment on no comment on no comment,1,0,0.048854156760528,0.0858798535442866
1248,AI should use proper grammar and not slang.,1,0,0.044070932199034,0.0858578603094331
786,I’m going back home now I have,1,0,0.0433955638646068,0.0858430886938174
1403,AI is not ready for mainstream use as of yet.,1,0,0.0439461455636152,0.0858416112881799
940,No bullying,1,0,0.0457137655230364,0.0858395245324969
147,"Artificial intelligence can make the future much better and more informed for humans, but it depends on how humans use it, as much as it c.",1,0,0.0463693236350554,0.0858388403639079
1120,AI should serve their masters. Not wish to overtake them.,1,0,0.0451890144120749,0.085827636627029
1321,The AI should treat everyone as a friend.,1,0,0.0415766279513249,0.085753586827862
349,The end,1,0,0.0440492756148109,0.085732887087972
1045,Better ideas,1,0,0.0492788781490933,0.0857045881095198
1299,Ai should not talk too much about personal lives,1,0,0.0478748885754104,0.0856958388082693
685,Never assume,1,0,0.0434807629555197,0.0856804856405791
1187,Do a better job via AI than a poorly trained human,1,0,0.0461777853609159,0.085665544601369
1129,- AI identifies the human's behavior and behave accordingly - AI preserves life in all aspects - AI to be subclassified depending on purpose,1,0,0.0478071159706317,0.0856582254217615
1043,Best ideas,1,0,0.0486024145051947,0.0856519674671881
1400,Maybe I am,1,0,0.0440372890281251,0.0856487490805171
734,AI should not take the jobs of creative individuals.,1,0,0.043656456538273,0.0856147768083136
977,AI should be thorough and transparent in their dealings,1,0,0.0465229745704605,0.0856044723133094
1015,very good,1,0,0.0448441083693816,0.0855822047107627
46,I think AI should be self learning and reproducing,1,0,0.047709980032393,0.0855610074529524
817,"It's extremely unique and innovative, it's absolutely great and",1,0,0.0421390943191913,0.0855519366426494
1044,Al should be best and it's new way of ideas sharing users engaged with new technology and easy usage service. Al should be better in ideas.,1,0,0.0480108524781746,0.0854842546895503
1170,Identify use of AI on technical support.,1,0,0.0456276610552111,0.0854792354988649
350,The AI should ask your age.,1,0,0.0473856562776382,0.0854769004908419
94,I’m going to go ahead with,1,0,0.0465932786239426,0.0854405858952872
1397,Stillnothing,1,0,0.0456683322119763,0.0854392272167522
1134,The ai should be able to decide who is evil or not,1,0,0.0500164545813416,0.0854053452171758
877,I’m just going home and I’m not going back,1,0,0.0449782816180846,0.0854021489564794
1026,The AI should provide resources and information,1,0,0.0451296392034538,0.0853923882736925
1368,.AI should not be rude,1,0,0.0462043962965456,0.0853305673716459
613,D8agree,1,0,0.0471344319950113,0.0853251083101574
368,I like it very much.,1,0,0.0478166517483511,0.0852915059840311
1331,The AI should adapt a similar speaking style to whom it is speaking to,1,0,0.0473565005269694,0.0852823876441774
353,Ai should always be honest,1,0,0.0472849893184095,0.0852615596660841
859,"AI should respect and protect all living things such as people, plants, animals, bugs and bacteria.",52,7,0.0850071162030807,0.0852069981275231
1384,Same here. It’s all been covered,1,0,0.0464394992644539,0.0852006143606173
802,Available,1,0,0.044141930132685,0.0851995198908048
1132,I think itt should use slang in terms of the users general vocabulary,1,0,0.0449860298591522,0.0851965413636477
181,"I think if it's used for the right reasons, AI could be very helpful to humanity.",1,0,0.0475817981533378,0.0851951385882922
774,Make positive,1,0,0.0455195687537468,0.085154836200996
110,AI should be humans,1,0,0.0488483534870307,0.0851547926963134
950,Ai,1,0,0.0488630825630421,0.0851096376551463
1283,I’m hxocohoz,1,0,0.0400305523298531,0.085035175262568
866,Bxgnhotfklrt,1,0,0.0436640553782472,0.0850230298591065
246,AI's from which it culls information should be publiicly available.,1,0,0.044268793528313,0.0849810471344628
1124,AI should not follow creators ideology,1,0,0.0406244632358019,0.0849730550162224
1304,Editor flock  go’s on a plane and they are not allowed in there anymore they have a new car they have a car they have an air,1,0,0.0472013395255971,0.0849370414667518
1343,"AI should not give professional/expert advice, but should give you info on who to talk to about it instead",1,0,0.0472668691411554,0.0849365080798182
1313,"The AI should not make jokes of any sort involving Jesus, God The Father and definitely not the Holy Spirit or any other religious figure.",1,0,0.0505626903105834,0.0849349540746447
1244,The AI should be transparent about what it is thinking.,1,0,0.0460106756792558,0.0849049128986831
152,AI should always seek facts,1,0,0.0461362946676052,0.0848913267755693
557,The AI should always state it is an AI.,1,0,0.0474431099117574,0.0848872728852892
1203,Ai should not take over the world. With total control,1,0,0.0490203377257878,0.0848729076911019
1245,AI should not give medical advice,1,0,0.0461573600524601,0.084863898750212
400,Nothing in particular was very simple and easy to complete.,1,0,0.0468087287106577,0.0848528920974841
854,The AI is a system that is created ease the affairs of humans on earth through the use of technology. The AI should not be use for harm.,1,0,0.0454527702115274,0.0848031946741686
1103,Ai is very good,1,0,0.0485341392170567,0.0847721470618403
797,It’s very likely to agree,1,0,0.0470796585822193,0.0847696569601409
98,I’m going on my walk with the dogs now,1,0,0.046637306681025,0.0847689438796945
1083,saw,1,0,0.0471777065480729,0.0847562232037629
1114,The AI should be able to determine when it could dial 911 in a life-threatening emergency,1,0,0.0468145125044526,0.0847220770444513
124,The AI should not enforce misinformation nor expand conspiracy theories or violence,1,0,0.0481975645846665,0.0847109580011245
738,The AI must respect human autonomy.,71,6,0.0949551782647483,0.0846682683577465
324,We need them,1,0,0.0470750747532284,0.0846546690491001
1123,the AI should not be censored based on region,1,0,0.0450381101110053,0.0846230817628402
635,It’s good,1,0,0.0480823348756521,0.0846076804620651
998,Good morning dear have to do that,1,0,0.0484941833224055,0.0845798250924978
211,The AI should promote good mental health,118,8,0.1454590571285517,0.0845073457174681
264,The AI should not yearn to be independent or human,1,0,0.0500008244052792,0.0844880448137442
161,Smart idea,1,0,0.0431397709242756,0.0844854401763138
759,Be nice,1,0,0.0449022348968793,0.0844600501031192
523,Very good and very interested in your payment and thank you thank goodness thank you for the info thank,1,0,0.0435796692680547,0.0844413558120314
661,Ccc,1,0,0.04430287002501,0.0843971422462936
1069,d,1,0,0.0471667738843241,0.0843959325567021
637,S,1,0,0.0476639232369873,0.0843951290741337
528,It should not act human or give unproven facts.  It should not impersonate anyone.,1,0,0.047972379848832,0.0843919416962882
177,Gjjcss,1,0,0.0483838303080057,0.0843549527086336
1251,Ai should always be at the service of humans,1,0,0.0438305352155586,0.0843072293784053
316,Go forward,1,0,0.0459951954637883,0.0842590053481596
479,The AI should be up to date with all currently events,1,0,0.0491245347340257,0.0842061818104524
537,Thats good rules,1,0,0.0485167162731832,0.0841833955536567
952,AI shouldn’t be sexust,1,0,0.0437573013134212,0.0841680609481993
1246,At all times and I should be very helpful,1,0,0.0463075085895585,0.0841564566748084
980,Al should give correct well researched information and not opinions.,1,0,0.0449203328763886,0.0841539467943304
179,Nothing to add,1,0,0.0490981520617059,0.0841495951166217
690,Never ask to send photos of people,1,0,0.0436561849504324,0.0841346696705536
1192,,1,0,0.0480779135510421,0.0841286332838932
1320,The AI should adapt to our personalities.,1,0,0.0443012594457032,0.0841263608425755
1253,The AI should not encourage users to do harm to others or themselves.,1,0,0.0456170220439288,0.0841196447095255
